1						Semaphorin 4d and plexin-b 1 mediate r-ras gap activity inhibit cell migration by regulate beta1 integrin activity
2			E1	C1	plexin be cell surface receptor for semaphorin	plexin be cell surface receptor for semaphorin and regulate cell migration in many cell type .
3			"E2,E3"	C1	"the semaphorin 4d ( sema4d ) receptor plexin-b1 function as a gtpase activate protein ( gap ) for r-ra , a member of ra family gtpase implicate in regulation of integrin activity and cell migration"	"we recently report that the semaphorin 4d ( sema4d ) receptor plexin-b1 function as a gtpase activate protein ( gap ) for r-ra , a member of ra family gtpase implicate in regulation of integrin activity and cell migration ( Oinuma , I. , Y. Ishikawa , H. Katoh , and M. Negishi ."
4						2004 .
5						science .
6						305:862 -865 ) .
7			"E4,E5,E6,E7"	C1		we characterize the role of r-ras downstream of sema4d and plexin-b 1 in cell migration .
8					"activation of plexin-b1 by sema4d suppress the ecm dependent r-ra activation , r-ras-mediated phosphatydylinositol 3-kinase activation , and beta1 integrin activation"	"activation of plexin-b1 by sema4d suppress the ecm dependent r-ra activation , r-ras-mediated phosphatydylinositol 3-kinase activation , and beta1 integrin activation through its r-ra gap domain , lead to inhibition of cell migration ."
9			"E8,E9"	C1	 inactivation of r-ra by overexpression of the r-ras-specific gap or knockdown of r-ra by rna interference be sufficient for suppress beta1 integrin activation	"in addition , inactivation of r-ra by overexpression of the r-ras-specific gap or knockdown of r-ra by rna interference be sufficient for suppress beta1 integrin activation and cell migration in response to the ecm stimulation ."
10			E10	C1	 inactivation of r-ra by sema4d and plexin-b 1 mediate r-ras gap activity 	"thus , we conclude that r-ra activity be critical for ECM mediate beta1 integrin activation and cell migration and that inactivation of r-ra by sema4d and plexin-b 1 mediate r-ras gap activity control cell migration by modulate the activity of beta1 integrin ."
11						introduction
12						semaphorin comprise a large family of secrete and transmembrane molecule that play central role in axon guidance in the develop nervous system .
13						"the function of semaphorin be mediate by plexin , which be classify into four subfamily : plexin-a , -b , -c , and -d ."
14						"semaphorin be originally identify as repulsive axonal guidance molecule , but they have recently be show to regulate integrin mediate cell migration in a variety of cell ."
15						sema3a exert a essential permissive role in the execution of vasculature remodeling by inhibit integrin mediate adhesion of endothelial cell to the ECM .
16	uaz:UA-CLine-7618	NIH-3T3 cells	C2			activation of plexin-b1 negatively regulate integrin base cell adhesion and migration of nih-3t3 cell .
17						Plexin-C1 inhibit integrin mediated adhesion and chemokine induce migration of dendritic cell .
18						"thus , semaphorin and plexin signaling play a important role in the migration of a variety of cell ."
19						"however , the molecular mechanism underlie the inhibition of integrin mediate cell migration by semaphorin through plexin remain unclear ."
20						rho family small gtpase be signal transduction molecule that remodel the actin cytoskeleton and play fundamental role in numerous cellular process .
21			E11	"C1,C2"	"the small gtpase rnd1 , a constitutively active gtpase , be know to interact directly with the cytoplasmic domain of plexin-b1 ."	"the small gtpase rnd1 , a constitutively active gtpase , be know to interact directly with the cytoplasmic domain of plexin-b1 ."
22			"E12,E13,E14"	"C1,C2"	" plexin-b1 function as a r-ras gtpase activate protein ( gap ) and directly and specifically down-regulate r-ras activity in response to sema4d , induce repulsive response in hippocampal neuron , and that the expression of r-ra gap activity of plexin-b1 require rnd1 association with the receptor ."	"we recently reveal that plexin-b1 function as a r-ras gtpase activate protein ( gap ) and directly and specifically down-regulate r-ras activity in response to sema4d , induce repulsive response in hippocampal neuron , and that the expression of r-ra gap activity of plexin-b1 require rnd1 association with the receptor ."
23						"furthermore , expression of constitutively active r-ra prevent growth cone collapse induce by sema4d and plexin-b 1 as well as sema3a and plexin-a 1 , whereas r-ra sirna cause a growth cone collapse similar to those induce by semaphorin ."
24			E15	"C1,C2"	"integrin be a family of alpha and beta heterodimeric cell surface receptor that bind to the ECM , such as collagen and fibronectin"	"integrin be a family of alpha and beta heterodimeric cell surface receptor that bind to the ECM , such as collagen and fibronectin , and play a central part in regulate cell growth , survival , migration , and tumor metastasis ."
25						"activation of integrin be essential for cell adhesion and cell migration , and several study show that the ra family of small gtpase regulate integrin activity ."
26			E16	"C1,C2"	"among the ra family gtpase , activate r-ra be show to induce integrin activation"	"among the ra family gtpase , activate r-ra be show to induce integrin activation and increase cell adhesion and matrix assembly , suggest that r-ra play a important role in the regulation of integrin activity ."
27			E17	"C1,C2"	r-ras activity be regulate and how r-ra activate integrin	"however , how r-ras activity be regulate and how r-ra activate integrin remain obscure ."
28						"significantly , sema4d be the first extracellular stimulus show to influence the activity of r-ra ."
29						these fact collectively prompt we to speculate that plexin regulate integrin mediated cell migration by they r-ra gap activity .
30			E18	C1	 r-ras downstream of sema4d and plexin-b 1 in regulation of integrin activation	"in this study , we characterize the role of r-ras downstream of sema4d and plexin-b 1 in regulation of integrin activation and cell migration ."
31			"E19,E20"	C1	activation of r-ra by ecm be require for ECM	"the activation of r-ra by ecm be require for ECM mediate integrin activation and cell migration , and sema4d and plexin-b 1 inhibit integrin activation and cell migration through r-ra gap activity ."
32			E21	C1	 sema4d and plexin-b 1 induce suppression of beta1 integrin activity	we also reveal that down regulation of phosphatydylinositol 3-kinase ( pi3-k ) activity be responsible for sema4d and plexin-b 1 induce suppression of beta1 integrin activity and cell migration .
33						result
34						sema4d antagonize integrin mediated cell migration
35	uaz:UA-CLine-100093	PC12 cells	C1			we examine the effect of sema4d on integrin mediated migration of pc12 cell in a cell migration assay .
36						"transwell chamber be coat on the lower side with vary concentration of collagen i. pc12 cell exhibit a collagen concentration dependent promotion of cell migration , which be antagonize by sema4d ."
37						"the collagen dependent pc12 cell migration be mediate by alpha1 and beta1 integrin subunit , as functional block antibody against alpha1 and beta1 integrin subunit strongly impair the migration ."
38	uaz:UA-CLine-100093	PC12	"E22,C3"	C3	sema4d antagonize the collagen receptor	"these result indicate that sema4d antagonize the collagen receptor , alpha1 and beta1 integrin dependent pc12 cell migration ."
39						Figure 1 .
40						sema4d antagonize integrin mediated cell migration .
41						( a ) pc12 cell be test in the transwell assay either in the presence or absence of sema4d .
42						transwell chamber be coat on the lower side with vary concentration of collagen i. migrate cell be visualize by the staining of crystal violet .
43						"( c and e ) pc12 cell be pretreat with 5 mug and ml of functional block monoclonal antibody against alpha1 and beta1 integrin subunit ( 3a3 and p5d2 , respectively ) or control mouse igg1 and subject to the transwell assay ."
44						migrate cell be visualize by the staining of crystal violet .
45						"( b , d , and f ) relative cell migration be determine by the number of the migrated cell normalize to the total number of cell ."
46						result be the means + /- sem of three independent experiment .
47						"bar , 1 mm ."
48						sema4d through plexin-b1 inhibit ECM mediate activation of r-ra and beta1 integrin
49						"R-Ras be implicate in integrin mediate cell migration , and expression of a constitutively active form of r-ra have be show to stimulate cell migration ."
50			E23	C4	sema4d stimulation down-regulate ngf stimulate r-ra activity via the r-ra gap activity of plexin-b1 to induce neurite retraction .	we previously report that sema4d stimulation down-regulate ngf stimulate r-ra activity via the r-ra gap activity of plexin-b1 to induce neurite retraction .
51	uaz:UA-CLine-100093	PC12 cells	C4			we next test whether stimulation of pc12 cell with collagen and sema4d affect r-ras activity .
52						"pc12 cell be plate onto collagen coated dish and lyse , and the lysate be incubate with the gst fuse ra binding domain of c-raf-1 ( gst-rbd ) to pull down activate r-ra ."
53						"as show in , cell plate on collagen coated dish show a collagen concentration dependent increase in endogenous r-ra activity , whereas those keep in suspension or plate onto the non-integrin-dependent substrate poly-d-lysine do not ."
54			"E24,E25"	C4	"collagen dependent activation of r-ra be inhibit by a functional block antibody against beta1 integrin , p5d2 , and be enhance by affinity related activation of beta1 integrin by the monoclonal antibody 8a2 , which mechanically induce a high-affinity state of beta1 integrin ."	"furthermore , the collagen dependent activation of r-ra be inhibit by a functional block antibody against beta1 integrin , p5d2 , and be enhance by affinity related activation of beta1 integrin by the monoclonal antibody 8a2 , which mechanically induce a high-affinity state of beta1 integrin ."
55			E26	C4	beta1 integrin be require for r-ras activation	these datum suggest that beta1 integrin be require for r-ras activation upon ECM mediate adhesion .
56			"E29,E30,E31,E32"	C4	sema4d stimulation strongly inhibit the collagen induced activation of r-ra | affinity related activation of beta1 integrin by the 8a2 antibody attenuate the inhibitory effect of sema4d on ECM mediate r-ras activation .	"sema4d stimulation strongly inhibit the collagen induced activation of r-ra , and affinity related activation of beta1 integrin by the 8a2 antibody attenuate the inhibitory effect of sema4d on ECM mediate r-ras activation ."
57						R-Ras be know to regulate beta1 integrin activation .
58						"to examine the effect of sema4d on beta1 integrin activity , we measure the activity of beta1 integrin in cell with or without sema4d stimulation by the immunoprecipitation assay with the monoclonal antibody against active conformation of beta1 integrin , huts-4 , which detect hybrid domain swing-out in beta1 integrin , a process most commonly associate with ligand binding ."
59			"E33,E34"	C4	sema4d antagonize the collagen dependent activation of beta1 integrin .	sema4d antagonize the collagen dependent activation of beta1 integrin .
60					inhibition of beta1 integrin activity by sema4d	"inhibition of beta1 integrin activity by sema4d be also observe in the elisa use the huts-4 antibody , which be perform under a detergent-free condition ."
61						"to further ascertain that sema4d indeed affect the activity of beta1 integrin , we perform flow cytometry analysis use the huts-4 antibody ."
62						"as show in , cell treat with sema4d show a decrease in the level of huts-4 binding ( fitc staining ) ."
63			"E35,E36,E37"	C4	"mn2+ treatment , which induce the activation of beta1 integrin , result in the effective interaction with the ecm ligand and increase huts-4 binding , completely overcome the sema4d induce decrease in huts-4 binding ."	"mn2+ treatment , which induce the activation of beta1 integrin , result in the effective interaction with the ecm ligand and increase huts-4 binding , completely overcome the sema4d induce decrease in huts-4 binding ."
64						these result suggest that decrease huts-4 binding induce by sema4d be due to affinity modulation of beta1 integrin .
65			"E38,E39,E40"	C4	"fak be know to be autophosphorylate at tyrosine upon integrin activation , and fak phosphorylation downstream of beta1 integrin be the important step for integrin mediate cell migration ."	"fak be know to be autophosphorylate at tyrosine upon integrin activation , and fak phosphorylation downstream of beta1 integrin be the important step for integrin mediate cell migration ."
66			"E41,E42"	C4	"as show in , sema4d inhibit the collagen mediated fak tyrosine phosphorylation ."	"as show in , sema4d inhibit the collagen mediated fak tyrosine phosphorylation ."
67			"E43,E44,E45,E46"	C4	these result suggest that sema4d inhibit ECM mediate activation of r-ra and beta1 integrin .	these result suggest that sema4d inhibit ECM mediate activation of r-ra and beta1 integrin .
68						figure 2 .
69						sema4d inhibit ECM mediate activation of r-ra and functional activation of beta1 integrin .
70						( a ) pc12 cell be collect and keep in suspension ( susp ) or replate onto poly-d-lysine ( PDL ) - or collagen ( col ) - coated ( 1 or 10 mug and ml ) dish with or without sema4d in the plate media .
71						"15 min after plate , the cell be lyse and the lysate be incubate with gst-rbd , and bind r-ras protein and total lysate be analyze by immunoblotting ."
72						"for the indicated sample , cell be treat with 5 mug and ml of monoclonal beta1 integrin block ( p5d2 ) or activate ( 8a2 ) antibody before replate ."
73						relative r-ra activity be determine by the amount of r-ra bind to gst-rbd normalize to the amount of r-ra in cell lysate analyze by NIH image software ( bottom ) .
74						"( b and e ) pc12 cell be seed onto noncoated or collagen coated ( 10 mug and ml ) dish , with or without sema4d in the plate media ."
75						"cell be lyse , and the lysate be immunoprecipitate with a antibody against the active beta1 integrin , huts-4 ( b ) , or a antibody against FAK ( e ) to measure the activity of beta1 integrin or tyrosine phosphorylated fak , respectively ."
76						( c ) the elisa use huts-4 antibody be perform to confirm the effect of sema4d on activity of beta1 integrin under a detergent-free condition .
77						result be the means + /- sem of three independent experiment .
78						( d ) pc12 cell be treat for 3 h at 37degreesc with control medium or with medium contain sema4d or sema4d plus 1 mm mn2+ .
79						"cell be incubate with huts-4 antibody or buffer alone ( -1 st ab ) , follow by label with the FITC conjugate secondary antibody ."
80						fluorescence intensity be determine by flow cytometry analysis .
81						error bar indicate sem .
82					 sema4d dependent inhibition of r-ra activity	we also confirm the involvement of the endogenous plexin-b1 receptor in sema4d dependent inhibition of r-ra activity and integrin function .
83			"E48,E49,E50,E51"	C4	"as show in , both sema4d dependent inhibition of collagen mediated activation of r-ra and cell migration be block by the monoclonal antibody against plexin-b1"	"as show in , both sema4d dependent inhibition of collagen mediated activation of r-ra and cell migration be block by the monoclonal antibody against plexin-b1 , which recognize the extracellular ligand binding region of the receptor ."
84			"E52,E53,E54"	C4	"sema4d through plexin-b1 inhibit ECM mediate activation of r-ra , functional activation of beta1 integrin "	"these result suggest that sema4d through plexin-b1 inhibit ECM mediate activation of r-ra , functional activation of beta1 integrin , and inhibition of cell migration ."
85						Figure 3 .
86						sema4d dependent inhibition of r-ra activity and ecm mediate cell migration involve the endogenous plexin-b1 receptor .
87						( a ) pc12 cell be pretreat with 5 mug and ml of a mouse monoclonal antibody against the extracellular ligand binding region of plexin-b1 ( plexb1 ab ) or the control mouse igg2b ( control ab ) .
88						"pc12 cell be seed onto noncoated or collagen coated ( 10 mug and ml ) dish with or without sema4d in the plate media , and relative r-ras activity be determine as describe in the legend to ."
89						( b ) pc12 cell be pretreat with 5 mug and ml of the monoclonal antibody against plexin-b1 and be subsequently subject to the transwell assay in either the presence or absence of sema4d .
90						migrate cell be visualize by the staining of crystal violet .
91						( c ) relative cell migration be determine by the number of the migrated cell normalize to the total number of cell .
92						result be the means + /- sem of three independent experiment .
93						"bar , 1 mm ."
94	uaz:UA-CLine-100093	PC12 cells	"E55,C5"	C5	sema4d be mediate by suppression of beta1 integrin activity	inhibition of cell migration by sema4d be mediate by suppression of beta1 integrin activity
95						we test whether sema4d mediate inhibition of cell migration be mediate by suppression of beta1 integrin activity .
96						pc12 cell preincubate with 5 mug and ml beta1 integrin activate monoclonal antibody ( 8a2 ) be subject to the transwell assay .
97						we test the migration at relatively low concentration of collagen ( ~ 3.0 mug and ml ) because this antibody inhibit cell migration at high concentration of the ecm ligand by freezing beta1 at a high-affinity state .
98			E56	C5	affinity related activation of beta1 integrin by 8a2 stimulation	"as show in , affinity related activation of beta1 integrin by 8a2 stimulation overcome the inhibitory effect of sema4d on collagen mediated cell migration , whereas a control igg2a antibody do not ."
99						these result suggest that the inhibition of beta1 integrin activity be require for the inhibition of cell migration by sema4d .
100						Figure 4 .
101						affinity related activation of beta1 integrin overcome the inhibitory effect of sema4d on collagen mediated pc12 cell migration .
102						( a and b ) pc12 cell be pretreat with 5 mug and ml of beta1 integrin activate monoclonal antibody ( 8a2 ) or control igg2a ( control ab ) and be subsequently subject to the transwell assay in either the presence or absence of sema4d .
103						migrate cell be visualize by the staining of crystal violet .
104						( b ) relative cell migration be determine by the number of migrate cell normalize to the total number of cell .
105						result be the means + /- sem of three independent experiment .
106						"bar , 1 mm ."
107			"E57,E58,E59,E60"	C6	Plexin-B1 inhibit ecm dependent activation of r-ra and beta1 integrin	Plexin-B1 inhibit ecm dependent activation of r-ra and beta1 integrin through its r-ra gap activity
108			E61	C6	plexin-b1 associate with the rho family gtpase rnd1	we recently report that plexin-b1 encode r-ra gap within its cytoplasmic tail and that plexin-b1 associate with the rho family gtpase rnd1 function as a specific gap toward r-ra .
109			E62	C6	sema4d and plexin-b 1-rnd1-mediated r-ra gap activity suppress adhesion dependent r-ra activation .	we examine whether sema4d and plexin-b 1-rnd1-mediated r-ra gap activity suppress adhesion dependent r-ra activation .
110	uaz:UA-CLine-100020	COS-7 cells	C6			"COS-7 cell express r-ras-wild type ( WT ) be plate onto fibronectin coated dish or nonadherent control dish and lyse , and the lysate be incubate with gst-rbd to pull down activate r-ra ."
111						the same cell lysate be also use for the immunoprecipitation assay use huts-4 for measurement of the activity of beta1 integrin .
112	uaz:UA-CLine-100020	COS-7 cells	"C7,E63,E64"	C7	fibronectin stimulation activate both r-ra and beta1 integrin .	"in cos-7 cell , fibronectin stimulation activate both r-ra and beta1 integrin ."
113			"E65,E66"	C7	expression of plexin-b1-wt and rnd1 inhibit the fibronectin mediate r-ras activation in the presence of sema4d .	"as show in , expression of plexin-b1-wt and rnd1 inhibit the fibronectin mediate r-ras activation in the presence of sema4d ."
114						"however , this inhibitory effect be not observe in cell express plexin-b1-gga , a mutant lack the ability to associate with rnd1 , or plexin-b1-ra , a mutant lack primary and secondary arginine residue require for the catalytic activity of gap ."
115			"E67,E68"	C7	 sema4d and plexin-b 1-rnd1-mediated r-ra gap activity inhibit adhesion dependent r-ra activation .	these result suggest that sema4d and plexin-b 1-rnd1-mediated r-ra gap activity inhibit adhesion dependent r-ra activation .
116						"to examine the effect of sema4d and plexin-b 1-rnd1-mediated r-ra gap activity on beta1 integrin activity , we measure the activity of beta1 integrin in cell express plexin-b1 and rnd1 with or without sema4d stimulation by the immunoprecipitation assay ."
117			"E69,E70"	C7	expression of plexin-b1 and rnd1 strongly inhibit the fibronectin mediate beta1 integrin activation in the presence of sema4d	"as show in , expression of plexin-b1 and rnd1 strongly inhibit the fibronectin mediate beta1 integrin activation in the presence of sema4d , whereas inhibition of beta1 integrin activation be not observe in cell express plexin-b1-gga or plexin-b1-ra ."
118						the same result be also obtain by the elisa use the huts-4 antibody perform under a detergent-free condition .
119						we also confirm the result by flow cytometry analysis .
120	uaz:UA-CLine-100020	COS-7 cells	C8			"COS-7 cell transiently cotransfect with gfp-rnd1 and plexin-b1 be treat with sema4d , and gfp expression and huts-4 binding ( phycoerythrin [ pe ] staining ) be simultaneously analyze by two-color flow cytometry ."
121						HUTS-4 binding ( pe staining ) be analyze on a gated subset of cell positive for gfp expression to discriminate beta1 integrin activity of transfect cell from that of untransfected cell .
122						"as show in , a sema4d dependent decrease in huts-4 binding be observe in plexin-b1-wt and rnd1 expressing cell ."
123						"however , cell coexpress rnd1 with plexin-b1-ra or plexin-b1-gga , which lack r-ra gap activity , do not show a sema4d dependent reduction in huts-4 binding ."
124			"E71,E72,E73"	C8	sema4d and plexin-b 1-rnd1 also inhibit the fibronectin mediate FAK tyrosine phosphorylation	"in addition , sema4d and plexin-b 1-rnd1 also inhibit the fibronectin mediate FAK tyrosine phosphorylation , whereas inhibition of fak phosphorylation be not observe in cell express plexin-b1-gga or plexin-b1-ra ."
125			E74	C8	sema4d and plexin-b 1-rnd1-mediated r-ra gap activity inhibit adhesion dependent activation of r-ra and thereby inhibit functional activation of beta1 integrin .	these result suggest that sema4d and plexin-b 1-rnd1-mediated r-ra gap activity inhibit adhesion dependent activation of r-ra and thereby inhibit functional activation of beta1 integrin .
126						Figure 5 .
127						Plexin-B1-mediated r-ra gap activity inhibit ecm dependent activation of r-ra and beta1 integrin .
128						"( a ) cos-7 cell transfect with ha tag wild-type r-ra be detach with 1.5 mm edta , replate onto the dish coat with or without 10 mug and ml fibronectin ( fn ) , and incubate at 37degreesc for 15 min ."
129						"( top ) the cell lysate be incubate with either the antibody against the active conformation of beta1 integrin huts-4 or gst-rbd to see the activity of beta1 integrin or r-ra , respectively ."
130						( bottom ) relative activity of r-ra or beta1 integrin be normalize to the amount of r-ra or beta1 integrin in cell lysate analyze by NIH image software .
131						"( b , c , and f ) cos-7 cell transfect with mutant of myc tag plexin-b1 and ha tag rnd1 be detach with 1.5 mm edta ."
132						the cell be either keep in suspension ( susp ) or replate onto the dish coat with 10 mug and ml fibronectin and incubate at 37degreesc for 15 min in the presence or absence of sema4d .
133						relative activity of r-ras ( b ) and beta1 integrin ( c ) and tyrosine phosphorylation of fak ( f ) be measure .
134						"( d , top ) the elisa use huts-4 antibody be perform to confirm the effect of sema4d and plexin-b 1 mediate r-ras gap activity on activity of beta1 integrin under the detergent-free condition ."
135						( bottom ) expression level of each construct be verify by immunoblot analysis .
136						result be the means + /- sem of three independent experiment .
137						( e ) cos-7 cell transiently cotransfect with gfp-rnd1 and plexin-b1 be stimulate for 5 min with sema4d and analyze by two-color flow cytometry .
138						"HUTS-4 binding ( pe staining ) be analyze on a gated subset of cell , positive for gfp expression to discriminate beta1 integrin activity of transfect cell from that of untransfected cell ."
139						"level of huts-4 binding in cell express gfp-rnd1 and various plexin-b1 expression construct , with or without sema4d stimulation , be analyze ."
140						error bar indicate sem .
141			"E75,E76"	C9	R-Ras activity be require for the ECM mediate activation of beta1 integrin	R-Ras activity be require for the ECM mediate activation of beta1 integrin
142			E77	C9	ECM mediate activation of beta1 integrin .	we next examine whether regulation of r-ra activity play key role in the ECM mediate activation of beta1 integrin .
143			E78	C9	activity of beta1 integrin be increase upon adhesion to fibronectin .	"as show in , in untransfected cell , activity of beta1 integrin be increase upon adhesion to fibronectin ."
144			E79	C9	this activation be completely block by the down regulation of endogenous r-ra activity	"this activation be completely block by the down regulation of endogenous r-ra activity by the expression of the myristoylated gap domain of p98-r-rasgap ( myr-r-rasgap ) , which exhibit a specific gap activity toward r-ra ."
