1						Semaphorin 4d and plexin-b 1 mediate r-ras gap activity inhibit cell migration by regulate beta1 integrin activity
145			E80	C9	constitutively active form of r-ra have be show to increase the affinity of beta1 integrin for fibronectin 	"R-Ras be implicate in integrin regulation , and the constitutively active form of r-ra have be show to increase the affinity of beta1 integrin for fibronectin and to stimulate cell migration ."
146			E81	C9	expression of r-ras-ql actually induce remarkable activation of beta1 integrin	"expression of r-ras-ql actually induce remarkable activation of beta1 integrin , and this be not further enhance by fibronectin ."
147			E82	C9	FAK tyrosine phosphorylation	we also test whether r-ra activity affect FAK tyrosine phosphorylation .
148			"E83,E84,E85,E86,E87,E88,E89,E90,E91"	C9	" expression of myr-r-rasgap completely block the fibronectin induce fak phosphorylation , whereas r-ras-ql markedly stimulate fak phosphorylation independent of fibronectin , indicate that endogenous r-ra activity be also require for ECM mediate fak phosphorylation ."	"as show in , expression of myr-r-rasgap completely block the fibronectin induce fak phosphorylation , whereas r-ras-ql markedly stimulate fak phosphorylation independent of fibronectin , indicate that endogenous r-ra activity be also require for ECM mediate fak phosphorylation ."
149			"E92,E93"	C9	requirement of r-ra in the ECM mediate functional activation of beta1 integrin .	we further confirm requirement of r-ra in the ECM mediate functional activation of beta1 integrin .
150	uaz:UA-CLine-100020	COS-7 cells	"C9,E94"	C9	 phosphorylation of fak	we reduce expression of r-ra in cos-7 cell by r-ras-specific sirna expression vector and examine the effect on the activation of beta1 integrin and phosphorylation of fak .
151			"E95,E96,E97,E98"	C9	reduction in r-ras protein block both the fibronectin dependent activation of beta1 integrin and phosphorylation of fak .	"as show in ( c and d ) , expression of r-ras sirna effectively reduce endogenous r-ra protein , and reduction in r-ras protein block both the fibronectin dependent activation of beta1 integrin and phosphorylation of fak ."
152			E99	C9	suppression of beta1 integrin activation by inactivation of r-ra	"the elisa use huts-4 , under detergent-free condition , also confirm suppression of beta1 integrin activation by inactivation of r-ra by expression of myr-r-rasgap or knockdown of r-ra by r-ras rna interference ."
153						we also confirm these result by two-color flow cytometry .
154						"COS-7 cell transiently transfect with myr- r-rasgap or a r-ras sirna together with gfp be stain with huts-4 , and huts-4 binding ( pe staining ) be analyze on gfp positive cell ."
155						"as show in , the level of huts-4 binding be reduce in cell express myr-r-rasgap or r-ras sirna ."
156			"E100,E101"	C9	 activation of the endogenous r-ra protein be essential for the ECM mediate functional activation of beta1 integrin .	these result demonstrate that activation of the endogenous r-ra protein be essential for the ECM mediate functional activation of beta1 integrin .
157						Figure 6 .
158						R-Ras activity be require for ecm mediated activation of beta1 integrin .
159						( A-D ) cos-7 cell express the indicated expression plasmid be detach with 1.5 mm edta in PBS and keep in suspension ( susp ) or replate onto the dish coat with 20 mug and ml poly-d-lysine ( PDL ) or 10 mug and ml fibronectin ( fn ) .
160						"after 15 min , activity of beta1 integrin ( a and c ) and tyrosine phosphorylated fak ( b and d ) be measure ."
161						"( e and f , top ) the elisa use huts-4 be perform under a detergent-free condition ."
162						( bottom ) expression level of each construct or the level of endogenous r-ras protein in cell transfect with sirna be verify by immunoblot analysis .
163						result be the means + /- sem of three independent experiment .
164						"( g ) cos-7 cell transiently transfect with myr-r-rasgap or a r-ras sirna together with gfp be stain with huts-4 , and huts-4 binding ( pe staining ) be analyze on gfp positive cell ."
165						Plexin-B1 inhibit cell migration through r-ra gap activity
166						we next examine the effect of sema4d and plexin-b 1 signaling on integrin mediate cell migration .
167	uaz:UA-CLine-100020	COS-7 cells	C10			"COS-7 cell express a control gfp alone exhibit a fibronectin concentration dependent promotion of cell migration , and ectopic expression of gfp-_NN r-ras-wt enhance this fibronectin dependent cell migration ."
168						"coexpression of plexin-b1-wt and rnd1 with r-ras-wt block the r-ras-induced promotion of cell migration toward fibronectin , in the presence of sema4d at the lower well ."
169						"on the other hand , expression of plexin-b1-ra , a mutant of plexin-b1 that lack r-ra gap activity , do not exhibit the sema4d dependent inhibition of cell migration toward fibronectin ."
170			"E102,E103"	C10	Association of rnd1 with plexin-b1 be essential for the expression of r-ra gap activity of plexin-b1	"Association of rnd1 with plexin-b1 be essential for the expression of r-ra gap activity of plexin-b1 , and inhibition of cell migration be not observe in the cell without rnd1 or in the cell express plexin-b1-gga , a mutant of plexin-b1 unable to interact with rnd1 ."
171			E104	C10	the plexin-b subfamily have be show to activate rhoa via its cooh-terminal pdz domain binding motif .	the plexin-b subfamily have be show to activate rhoa via its cooh-terminal pdz domain binding motif .
172						"however , plexin-b1-deltac , a mutant of plexin-b1 that lack the pdz domain binding motif but still have r-ras gap activity , inhibit fibronectin dependent cell migration in the presence of sema4d ."
173						"cell migration mediate by constitutively active r-ra , r-ras-ql , be not suppress by the sema4d and plexin-b 1 and rnd1 complex ."
174						"expression level of these construct use in the assay be similar , as verify by immunoblot analysis ( not depict ) ."
175						"furthermore , r-ras activity be essential for ECM mediate cell migration , as both inactivation of r-ra by expression of myr-r-rasgap or knockdown of r-ra by r-ras rna interference almost completely suppress the fibronectin dependent cell migration ."
176						Figure 7 .
177						Plexin-B1 inhibit ECM mediate cell migration through r-ra gap activity .
178						"( a and b ) cos-7 cell express gfp or gfp-r-ras-wt be use in a cell migration assay , use transwell chamber coat on the lower side with vary concentration of fibronectin ( fn ) ."
179						"migrate cell be visualize by the fluorescence of gfp ( a ) , and relative cell migration be determine ( b ) ."
180						( c ) cos-7 cell express gfp-r-ras-wt together with plexin-b1-wt and rnd1 be test in the transwell assay in either the presence or absence of sema4d .
181						( d ) cos-7 cell express the listed plasmid be test in the transwell assay use the chamber coat with vary concentration of fibronectin in either the presence ( close symbol ) or absence ( open symbol ) of sema4d .
182						migrate cell be visualize by the fluorescence of gfp .
183						( e ) relative cell migration at the point of 20 mug and ml fibronectin with or without sema4d be determine .
184						expression level of the construct be verify by immunoblot analysis ( not depict ) .
185						( f ) cos-7 cell transfect with the indicated plasmid be test in a cell migration assay use the transwell coat on the lower side with vary concentration of fibronectin .
186						relative cell migration be determine by the number of the migrated cell normalize to the total number of the transfected cell .
187						result be the means + /- sem of three independent experiment .
188						"bar , 1 mm ."
189	uaz:UA-CLine-100093	PC12 cells	C11			we further confirm that the r-ra gap activity exhibit by endogenous plexin-b1 be require for sema4d mediate inhibition of ECM mediate pc12 cell migration .
190			E105	C11	we recently report that the cytoplasmic region of plexin-b1 by nature take the intramolecularly tethered form and that disruption of the interaction between the nh2-terminal region ( n-cyt ) and the cooh-terminal region ( c-cyt ) within the cytoplasmic domain by rnd1 binding to n-cyt be essential for exhibit the r-ra gap activity .	we recently report that the cytoplasmic region of plexin-b1 by nature take the intramolecularly tethered form and that disruption of the interaction between the nh2-terminal region ( n-cyt ) and the cooh-terminal region ( c-cyt ) within the cytoplasmic domain by rnd1 binding to n-cyt be essential for exhibit the r-ra gap activity .
191						"C-Cyt associate with n-cyt-gga , which have no ability to interact with rnd1 , and rnd1 can not disrupt this interaction ."
192			"E106,E107,E108"	C11	" overexpression of plexin-b1-n-cyt-gga could effectively block the sema4d and plexin-b 1 and rnd1 complex mediate r-ras gap activity , suggest that plexin-b1-_NN n-cyt-gga could be a effective tool to inhibit the r-ra gap activity of plexin-b1 in a dominant negative manner ."	"as show in , overexpression of plexin-b1-n-cyt-gga could effectively block the sema4d and plexin-b 1 and rnd1 complex mediate r-ras gap activity , suggest that plexin-b1-_NN n-cyt-gga could be a effective tool to inhibit the r-ra gap activity of plexin-b1 in a dominant negative manner ."
193						overexpression of plexin-b1-n-cyt-gga in pc12 cell almost completely block the sema4d mediate inhibition of ECM mediate cell migration .
194						Figure 8 .
195						R-Ras gap activity of endogenous plexin-b1 be require for sema4d mediate inhibition of integrin mediate pc12 cell migration .
196						( a ) schematic representation of the plexin-b1-n-cyt-gga construct use in the experiment .
197						the rnd1 binding region and the r-ra gap domain ( c1 and c2 ) be indicate .
198						"letter indicate the specific amino acid residue within domain ( a , alum ; f , phe ; g , gly ; l , leu ; p , pro ; r , arg ; v , val ) , and number indicate amino acid position within the sequence ."
199						( b ) relative activity of r-ra be determine as describe in the legend to .
200						( c ) pc12 cell transfect with gfp alone or gfp plus ha-plexin-b1-n-cyt-gga be test in the transwell assay in either the presence or absence of sema4d .
201						( d ) relative cell migration be determine by the number of the migrated cell normalize to the total number of cell .
202						migrate cell be visualize by the fluorescence of gfp .
203						result be the means + /- sem of three independent experiment .
204						"bar , 1 mm ."
205						we also examine the role of endogenous r-ras protein in pc12 cell migration .
206	uaz:UA-CLine-100093	PC12 cells	C12			"transfection of the r-ras sirna effectively reduce the expression of endogenous r-ras protein in pc12 cell , whereas the control sirna do not work , and expression of r-ras sirna almost completely suppress the collagen dependent cell migration , suggest that r-ra be a prime regulator for integrin mediate cell migration in pc12 cell ."
207			E109	C12	sema4d and plexin-b 1 mediate r-ras gap activity	these result demonstrate that activation of endogenous r-ras protein be essential for the ecm mediate cell migration and that regulation of r-ra activity through sema4d and plexin-b 1 mediate r-ras gap activity play a key role in ECM mediate cell migration .
208			E110	C13	sema4d and plexin-b 1-rnd1 inhibit pi3-k activity through its r-ra gap activity	sema4d and plexin-b 1-rnd1 inhibit pi3-k activity through its r-ra gap activity
209						"PI3-K be the predominant effector of r-ra , and r-ras-mediated cell migration be sensitive to pharmacological pi3-k inhibitor ."
210	uaz:UA-CLine-100020	COS-7 cell	"E111,E112,C13"	C13	expression of r-ras-ql induce the ecm independent functional activation of beta1 integrin and tyrosine phosphorylation of fak	expression of r-ras-ql induce the ecm independent functional activation of beta1 integrin and tyrosine phosphorylation of fak and cause cos-7 cell migration in the absence of ecm ligand .
211			E113	C13	 pi3-k inhibitor ly294002	the d64a mutation of r-ra or the pharmacological pi3-k inhibitor ly294002 abrogate the cell migration induce by r-ras-ql .
212			"E114,E115,E116,E117"	C13	"R-Ras-QL-64A , the effector loop mutant of r-ra , impair the ability of r-ra to activate pi3-k , and r-ras-ql-mediated phosphorylation of the pi3-k effector akt ( pkb ) be abolish by the d64a mutation ."	"R-Ras-QL-64A , the effector loop mutant of r-ra , impair the ability of r-ra to activate pi3-k , and r-ras-ql-mediated phosphorylation of the pi3-k effector akt ( pkb ) be abolish by the d64a mutation ."
213			"E118,E119"	C13	r-ras-ql-induced activation of beta1 integrin and subsequent fak phosphorylation .	we further examine the involvement of pi3-k in r-ras-ql-induced activation of beta1 integrin and subsequent fak phosphorylation .
214			"E120,E121,E122,E123"	C13	d64a mutation or ly294002 treatment markedly block both r-ras-ql-induced activation of beta1 integrin and phosphorylation of the downstream effector fak .	"as show in , d64a mutation or ly294002 treatment markedly block both r-ras-ql-induced activation of beta1 integrin and phosphorylation of the downstream effector fak ."
215			E124	C13	prominent pi3-k-dependent phosphorylation of akt	it have be report that prominent pi3-k-dependent phosphorylation of akt occur in response to beta1 integrin mediate adhesion .
216			E125	C13	the effect of sema4d and plexin-b 1 mediate r-ras gap activity on pi3-k activity by measure the phosphorylation of akt .	we examine the effect of sema4d and plexin-b 1 mediate r-ras gap activity on pi3-k activity by measure the phosphorylation of akt .
217			"E126,E127,E128"	C13	expression of plexin-b1-wt and rnd1 inhibit the fibronectin mediate akt phosphorylation in the presence of sema4d .	"as show in , expression of plexin-b1-wt and rnd1 inhibit the fibronectin mediate akt phosphorylation in the presence of sema4d ."
218						"however , this inhibition be not observe in cell express plexin-b1-gga or plexin-b1-ra that have no ability to exhibit r-ras gap activity ."
219			"E130,E133"	C13	 pi3-k activity be necessary for r-ras-mediated activation of beta1 integrin and that sema4d and plexin-b 1-rnd1 inactivate pi3-k through down regulation of r-ra activity .	these result suggest that pi3-k activity be necessary for r-ras-mediated activation of beta1 integrin and that sema4d and plexin-b 1-rnd1 inactivate pi3-k through down regulation of r-ra activity .
220						Figure 9 .
221						sema4d and plexin-b 1-rnd1 inhibit pi3-k activity through inactivation of r-ra .
222						"( a ) cos-7 cell transfect with gfp-r-ras-ql or its effector loop mutant , r-ras-ql-64a , be test in a cell migration assay use the noncoated bare transwell in either the presence or absence of 20 mum ly294002 ."
223						"bar , 1 mm ."
224						( b ) relative cell migration be determine .
225						result be the means + /- sem of three independent experiment .
226						( c ) phosphorylate and total akt be analyze by immunoblot with phospho-akt ( ser473 ) and total akt antibody .
227						( d and e ) the state of beta1 integrin activity ( d ) and fak tyrosine phosphorylation ( e ) be analyze .
228						"( f ) cos-7 cell prepare as describe in the legend to be directly lyse on dish , and the lysate be analyze by the immunoblot analysis with phospho-akt ( ser473 ) and total akt antibody ."
229						result be the means + /- sem of three independent experiment .
230			"E134,E135"	C14	down regulation of pi3-k activity be responsible for sema4d and plexin-b 1 induce suppression of beta1 integrin activity	down regulation of pi3-k activity be responsible for sema4d and plexin-b 1 induce suppression of beta1 integrin activity
231			E136	C14	sema4d and plexin-b 1 to inhibit beta1 integrin activation .	"to clear out the role of pi3-k downstream of sema4d and plexin-b 1 , lead to suppression of beta1 integrin activity , we transfect p110alpha-caax , a constitutively active form of pi3-k , and test the ability of sema4d and plexin-b 1 to inhibit beta1 integrin activation ."
232	uaz:UA-CLine-100020	COS-7 cells	C14			"in cos-7 cell , overexpression of p110alpha-caax by itself do not induce beta1 integrin activation in the absence of fibronectin ."
233			"E137,E138"	C14	overexpression of the kinase-dead form of p110alpha block the fibronectin dependent beta1 integrin activation .	"on the other hand , overexpression of the kinase-dead form of p110alpha block the fibronectin dependent beta1 integrin activation ."
234			E139	C14	pi3-k activity be necessary but that pi3-k activity by itself be not sufficient for induce beta1 integrin activation .	these result suggest that pi3-k activity be necessary but that pi3-k activity by itself be not sufficient for induce beta1 integrin activation .
235			E140	C14	down regulation of pi3-k activity downstream of sema4d and plexin-b 1 be necessary for inhibition of beta1 integrin activity .	we next examine whether the down regulation of pi3-k activity downstream of sema4d and plexin-b 1 be necessary for inhibition of beta1 integrin activity .
236			"E141,E142"	C14	 overexpression of p110alpha-caax block sema4d and plexin-b 1 dependent inactivation of beta1 integrin .	"as show in , overexpression of p110alpha-caax block sema4d and plexin-b 1 dependent inactivation of beta1 integrin ."
237						we also examine the ability of sema4d to inhibit cell migration in cell express p110alpha-caax .
238	uaz:UA-CLine-100093	PC12 cells	C15			"as show in , overexpression of p110alpha-caax in pc12 cell almost completely block the sema4d mediate inhibition of cell migration ."
239			E143	"C14,C15"	"down regulation of pi3-k activity , downstream of sema4d and plexin-b 1 , be responsible for suppression of beta1 integrin activity"	"these result suggest that down regulation of pi3-k activity , downstream of sema4d and plexin-b 1 , be responsible for suppression of beta1 integrin activity and inhibition of the ecm mediate cell migration ."
240						Figure 10 .
241						down regulation of pi3-k activity be responsible for sema4d and plexin-b 1 induce suppression of beta1 integrin activity .
242						"( a , leave ) lysate of cos-7 cell express p110alpha-caax , a constitutively active form of pi3-k , or its kinase-dead ( kd ) form be immunoprecipitate with huts-4 ."
243						( right ) relative beta1 integrin activity be analyze .
244						( b ) activity of beta1 integrin in cos-7 cell express the indicated expression plasmid with or without sema4d stimulation be examine .
245						( c and d ) pc12 cell transfect with gfp alone ( open symbol ) or gfp plus p110alpha-caax ( close symbol ) be test in the transwell assay in either the presence or absence of sema4d .
246						result be the means + /- sem of three independent experiment .
247						"bar , 1 mm ."
248						discussion
249						"cell migration be a fundamental cellular process in many cell type , and semaphorin be know to act as a negative regulator for integrin mediate cell migration ."
250			"E144,E145"	"C14,C15"	"sema4d receptor , plexin-b1 , down-regulate r-ra activity and inhibit ECM mediate integrin activation and cell migration through its r-ra gap activity ."	"we show that the sema4d receptor , plexin-b1 , down-regulate r-ra activity and inhibit ECM mediate integrin activation and cell migration through its r-ra gap activity ."
251			E146	"C14,C15"	a constitutively active form of r-ra have be show to increase the affinity of integrin for fibronectin	"R-Ras be implicate in integrin regulation , and a constitutively active form of r-ra have be show to increase the affinity of integrin for fibronectin and to stimulate cell migration ."
252			"E147,E148,E149,E150,E151,E152"	"C14,C15"	 r-ra in ECM mediate integrin activation | inactivation of r-ra activity by expression of the gap domain of p98-r-rasgap or knockdown of r-ra by r-ras-specific sirna markedly reduce ECM mediate integrin activation	"we have examine a role of r-ra in ECM mediate integrin activation and cell migration and show that r-ra be markedly activate by the ecm and that this activation be require for activation of beta1 integrin and subsequent cell migration , as inactivation of r-ra activity by expression of the gap domain of p98-r-rasgap or knockdown of r-ra by r-ras-specific sirna markedly reduce ECM mediate integrin activation and cell migration ."
253			E153	"C14,C15"	 beta1 integrin be require for r-ras activation upon ECM mediate adhesion .	we result also reveal that beta1 integrin be require for r-ras activation upon ECM mediate adhesion .
254						"this suggest a positive feedback during cell-substrate adhesion , implicate r-ras activation and the consequent further strengthening of integrin mediate function ."
255						"therefore , r-ra be a central regulator for ECM mediate integrin activation and cell migration , and the regulation of r-ra activity be critical for integrin mediate cell migration ."
256						semaphorin be implicate in migration of a variety of cell .
257	uaz:UA-CLine-7618	NIH-3T3 cells	"E154,C16"	C16	stimulation of plexin-b1 by sema4d	stimulation of plexin-b1 by sema4d be report to hamper integrin base adhesion and cell migration in nih-3t3 cell .
258	uaz:UA-ORG-623	neuronal growth cone	"E155,E156,C17"	C17	stimulation of the plexin-b1-rnd1 complex by sema4d induce the r-ra gap activity	we have report that plexin-b1 encode a r-ra gap in the cytoplasmic tail and that stimulation of the plexin-b1-rnd1 complex by sema4d induce the r-ra gap activity and resultant repulsive response of neuronal growth cone .
259			"E157,E158"	"C14,C15"	plexin-b1 / rnd1 mediate r-ras gap activity	we demonstrate here that plexin-b1 / rnd1 mediate r-ras gap activity be also involve in sema4d induce inhibition of integrin activation and cell migration .
260			E159	"C14,C15"	the cooh-terminal pdz domain binding motif of plexin-b1 be dispensable for suppression of integrin activity 	"furthermore , the cooh-terminal pdz domain binding motif of plexin-b1 be dispensable for suppression of integrin activity and cell migration by sema4d ."
261						"in addition to sema4d , class 3 semaphorin have be show to control adhesion and migration of endothelial cell by inhibit integrin function , and sema3a signaling deficient mouse have show defective migration of neural crest cell ."
262						"furthermore , plexin-c1 , a receptor of semaphorin a39r , be recently report to inhibit integrin mediated adhesion and chemokine induce migration ."
263						"the r-ras gap-homologous domain be well conserve among plexin family , include plexin-a and -c1 ."
264	uaz:UA-ORG-623	hippocampal neurons	"E160,C18"	C18	down regulation of r-ra activity be also require for the sema3a and plexin-a-induced repulsive response	"in addition , we recently report that the down regulation of r-ra activity be also require for the sema3a and plexin-a-induced repulsive response in hippocampal neuron ."
265						we speculate that the direct regulation of r-ra activity by plexin be likely to be a mutual signaling pathway among plexin family and that this r-ra gap activity of plexin family may be a critical signaling system for semaphorin regulate cell migration .
266						"semaphorin be initially identify as repulsive factor for axon guidance , and many neuron use member of the integrin family of cell surface receptor for response to neurite growth promote factor , and integrin activation regulate neurite outgrowth ."
267	uaz:UA-ORG-623	retinal neurons	C19			"recently , expression of constitutively active r-ra be show to promote integrin dependent neurite outgrowth of retinal neuron , suggest that r-ra activity play a important role in integrin dependent neurite outgrowth ."
268			"E161,E162"	C19	down regulation of r-ra activity by plexin-b1 via r-ra gap activity suppress r-ras-mediated integrin activation	"therefore , it be propose that the down regulation of r-ra activity by plexin-b1 via r-ra gap activity suppress r-ras-mediated integrin activation and thereby induce growth cone collapse and inhibition of neurite outgrowth ."
269			"E163,E164"	C19	"the ephrin-b1 receptor ephb2 , another family of the repulsive factor receptor , be also report to suppress integrin mediate function by inactivate r-ra"	"with respect to signaling of other repulsive factor , the ephrin-b1 receptor ephb2 , another family of the repulsive factor receptor , be also report to suppress integrin mediate function by inactivate r-ra , suggest that repulsive guidance cue inhibit integrin mediated function by inactivate r-ra in general and that r-ras act as a common regulator of integrin activation and cell migration ."
270			"E165,E166,E167"	"C14,C15"	sema4d and plexin-b 1 mediate r-ras gap activity lead to inactivation of beta1 integrin and find that down regulation of pi3-k activity be responsible for sema4d and plexin-b 1 induce suppression of beta1 integrin activity	we also examine the downstream signaling of sema4d and plexin-b 1 mediate r-ras gap activity lead to inactivation of beta1 integrin and find that down regulation of pi3-k activity be responsible for sema4d and plexin-b 1 induce suppression of beta1 integrin activity and cell migration .
271						PI3-K activity be know to be require for r-ras-mediated enhancement of cell migration .
272						"PI3-K have emerge as the predominant effector for r-ra , and r-ra be a more potent activator of pi3-k than other ra family member ."
273						"on the other hand , pi3-k activity have be show to promote interaction between talin with the beta1 integrin cytoplasmic tail , lead to the clustering and activation of integrin ."
274						integrin activation by mechanical stretch be also mediate by pi3-k and be follow by a increase in integrin binding to the extracellular matrix protein .
