1						Semaphorin 4d and plexin-b 1 mediate r-ras gap activity inhibit cell migration by regulate beta1 integrin activity
275						"therefore , elevated pi3-k activity by activate r-ra may trigger a sequence of event lead to clustering and activation of integrin , although overexpression of p110alpha-caax by itself be not sufficient for induce beta1 integrin activation ."
276			"E168,E169,E170"	"C14,C15"	sema4d and plexin-b 1 mediate r-ras gap activity suppress affinity of beta1 integrin through inactivation of pi3-k activity .	"we use the monoclonal antibody huts-4 , which detect hybrid domain swing-out in beta1 integrin , a process most commonly associate with ligand binding affinity , to measure activity of beta1 integrin and reveal that sema4d and plexin-b 1 mediate r-ras gap activity suppress affinity of beta1 integrin through inactivation of pi3-k activity ."
277	uaz:UA-CLine-100061	mast cells	"E171,C20"	C20	r-ras-mediated increase in affinity of the beta1 integrin be dependent on pi3-k activity	"consistent with we result , a previous report demonstrate that a r-ras-mediated increase in affinity of the beta1 integrin be dependent on pi3-k activity by perform the ligand binding assay in mast cell ."
278	uaz:UA-CLine-100019	CHO cells	"E172,C21"	C21	 r-ras-mediated integrin activation	"on the other hand , have show that pi3-k activity be not require for r-ras-mediated integrin activation in cho cell by use a ligand-mimetic antibody , pac-1 ."
279						"therefore , we speculate that this discrepancy may be due to the difference in way to measure integrin activity or that r-ra may regulate integrin activity via both pi3-k-dependent and -independent pathway , depend on the cell type ."
280						"in conclusion , we result demonstrate that r-ra activity be require for ECM mediate integrin activation and cell migration and that the sema4d and plexin-b 1 and rnd1 complex regulate integrin activation and cell migration through the r-ra gap activity ."
281						"however , a variety of molecule such as erbb-2 and Met have be know to be involve in plexin signaling , induce diverse physiological function ."
282						it be recently show that plexin-b1 enhance chemotaxi of endothelial cell through the activation of multiple intracellular tyrosine kinase cascade independent of the r-ra gap activity .
283						"regulation of r-ra activity , tyrosine kinase , and other signaling mechanism may participate in diverse action of plexin ."
284						"further work will be require to delineate the precise mechanism of r-ras-mediated integrin activation and its regulation by plexin for cell migration during physiological and pathological process , include neural cell migration , angiogenesis , and tumor metastasis ."
285						Materials and method
286						dna construct and site directed mutagenesis
287						"Plexin-B1 cdna be provide by L. Tamagnone ( Torino University , Torino , Italy ) ."
288						"ha tag rnd1 ; ha-_NN and gfp tag human r-ra and r-ras-ql ( q87l ) ; the gst fuse ra binding domain of c-raf-1 ( amino acid 53-130 ) ; the nh2-terminal ha tag myristoylate form of r-rasgap ; and myc tag plexin-b1 , plexin-b1-gga ( l1849g , v1850g , and p1851a ) , plexin-b1-ra ( r1677a , r1678a , and r1984a ) , plexin-b1-deltac ( lack the last seven cooh-terminal amino acid ) , and plexin-b1-_NN n-cyt-gga ( amino acid 1511-1915 ) be describe previously ."
289						"the effector loop mutant of r-ra , r-ras-da ( d64a ) , be generate by a pcr mediated mutagenesis ."
290						"nh2-terminal flag tag p110alpha be a gift from t. katada ( Tokyo University , Tokyo , Japan ) , and caax sequence be fuse to the cooh terminus to create a constitutively active form as describe previously ."
291						"the specific sirna for r-ra be design to target 19 nucleotide at nucleotide 359 and 377 ( 5 ' - gcaagctcttcactcagat-3 ' ) , whereas the control sirna be design at nucleotide 426 and 444 ( 5 ' - caaggcagatctggagaca-3 ' ) , and both be express by use a sirna expression vector ( Ambion ) as describe previously ."
292						antibody and reagent
293						the pharmacological pi3-k inhibitor ly294002 be purchase from Calbiochem .
294						"a soluble form of sema4d fuse to human igg1-fc be a gift from H. Kikutani ( Osaka University , Osaka , Japan ) ."
295						"we use the follow antibody : mouse monoclonal antibody against myc and phosphotyrosine ; a rabbit polyclonal antibody against p125-fak ( Upstate Biotechnology ) ; mouse monoclonal antibody against alpha-tubulin ( Sigma-Aldrich ) , beta1 integrin ( BD Biosciences ) , and active beta1 integrin , huts-4 ( Chemicon ) ; a rabbit polyclonal antibody against r-ras ( Santa Cruz Biotechnology , Inc. ) ; a rat monoclonal antibody against HA ( Roche ) ; and HRP conjugate secondary antibody ( dakocytomation ) ."
296						"for functional study in the transwell assay , we use the follow antibody : the affinity related beta1 integrin activate monoclonal antibody 8a2 ( igg2a ) ; the functional block monoclonal antibody against the integrin alpha1 subunit , 3a3 ( igg1 ; Serotec ) ; the functional block monoclonal antibody against the integrin beta1 subunit , p5d2 ( igg1 ; Chemicon ) ; and a mouse monoclonal antibody against the extracellular ligand binding region ( raise against amino acid 771-1070 of human origin ) of plexin-b1 ( igg2b ; Santa Cruz Biotechnology , Inc. ) ."
297						fitc-_NN and pe conjugate f ( ab ' ) 2 specific secondary antibody for flow cytometry be purchase from Jackson ImmunoResearch Laboratories .
298						the phosphoplus akt antibody kit ( cell signaling ) be use for the analysis of the phosphorylation state of akt .
299						immunoblotting
300						protein be separate by 12.5 % sds-page and be electrophoretically transfer onto a polyvinylidene difluoride membrane ( Millipore ) .
301						the membrane be block with 3 % low-fat milk in tb and incubate with primary antibody .
302						the primary antibody be detect with hrp conjugate secondary antibody and a chemiluminescence detection kit ( Chemi-Lumi one ; Nacalai Tesque ) .
303						image be capture use a LAS 1000 analyzer ( Fuji ) equip with image gauge 4.0 software ( Fuji ) .
304						immunofluorescence microscopy
305						cell on coverslip be fix with 4 % pfa in PBS for 15 min and wash with PBS five time .
306						cell be permeabilized with 0.2 % Triton x-100 in PBS for 10 min and incubate with 10 % fb in PBS for 30 min to block nonspecific antibody binding .
307						cell be incubate with a anti-r-ras antibody ( 1:200 dilution ) for 1 h and then incubate with a Alexa Fluor 594 conjugate secondary antibody for 1 h. cell be wash in PBS for 1 h and mount in 90 % glycerol contain 0.1 % p-phenylenediamine dihydrochloride in PBS .
308						image be capture at rt use a microscope ( Eclipse e800 ; Nikon ) and a 40 x 0.75 objective ( Nikon ) equip with a digital camera ( dc350f ; Leica ) .
309						the image be arrange and label use Photoshop software ( Adobe ) .
310						cell culture and transfection
311						"COS-7 cell be culture in dme contain 10 % fb , 4 mm glutamine , 100 U and ml penicillin , and 0.2 mg and ml streptomycin under humidified condition in 95 % air and 5 % co2 at 37degreesc ."
312						pc12 cell be maintain in rpmus 1640 with 10 % horse serum ( h ) and 5 % fb .
313						transient transfection be perform with lipofectamine 2000 ( Invitrogen ) accord to the manufacturer 's instruction .
314						a soluble form of sema4d be express as a fusion protein with the fc fragment of human igg1 .
315						stimulation with sema4d be perform by incubation of the cell with sema4d-fc-containing medium at 37degreesc .
316						cell migration assay
317						"104 cell be detach with 1.5 mm edta in PBS , wash three time with serum-free medium , resuspend in dme contain 1 % bsa , seed on the upper side of 8-mum pore filter of transwell chamber ( costar ) , which be coat on the lower side with vary concentration of either fibronectin or collagen I ( Sigma-Aldrich ) , and incubate for 7 h. cell on the upper side of the filter be mechanically remove , and cell on the lower side be fix with 4 % pfa ."
318						the number of migrate cell through the filter be count by the fluorescence of gfp or the staining with crystal violet ( a ) .
319						"at the same time , the cell be seed onto 24-well plastic culture plate to count the total number of transfect cell ( b ) ."
320						relative cell migration be then determine by the number of migrate cell normalize to the total number of transfect cell ( a and b ) .
321						"unless describe , the value from the gfp transfect cell in the absence of coating be define as 1 ."
322						"for functional study use activate or inhibitory monoclonal antibody , cell be pretreat with 5 mug and ml of antibody or corresponding negative igg control for 5 min before seed onto the transwell ."
323						image be capture at rt in PBS use a microscope ( Eclipse te300-fn ; Nikon ) and a plan Fluor 10 x 0.30 objective ( Nikon ) equip with digital camera ( ds-l1 and ds-5m ; Nikon ) .
324						the image be arrange and label use Photoshop 7.0 software .
325						measurement of the activity of beta1 integrin by immunoprecipitation
326						measurement of beta1 integrin activity by immunoprecipitation be perform as describe previously .
327						3 x 106 cos-7 cell be maintain in dme contain 1 % fb after transfection .
328						"16 h after transfection , cell be detach with 1.5 mm edta in PBS , wash three time with serum-free medium , and resuspend in 10 ml of 1 % bsa in dme with or without sema4d-fc ."
329						the cell suspension be plate onto 10-cm plate coat with or without 10 mug and ml fibronectin and incubate at 37degreesc for 15 min .
330						"the cell be lyse directly on dish with ice-cold cell lysis buffer ( 50 mm tris-hcl , ph 7.5 , 150 mm nacl , 1 % Triton x-100 , 10 % glycerol , 1 mm sodium vanadate , 25 mm naf , 10 mug and ml pepstatin , 1 mm pmsf , 10 mug and ml aprotinin , and 10 mug and ml leupeptin ) contain 5 mug and ml huts-4 , immunoprecipitate for 2 h , and subsequently incubate with protein g-sepharose bead ( GE Healthcare ) for 1 h at 4degreesc ."
331						"after the bead be wash twice with the ice-cold cell lysis buffer , the bound protein be elute in laemmli sample buffer and analyze by sds-page and immunoblotting with the monoclonal antibody against beta1 integrin ."
332						"to measure the activity of beta1 integrin in pc12 cell , 106 cell be maintain in rpmus 1640 contain 1 % h for 12 h , detach with 1.5 mm edta in PBS , wash three time with serum-free medium , and resuspend in 10 ml of 1 % bsa in rpmus 1640 with or without sema4d-fc ."
333						the cell suspension be plate onto 10-cm plate coat with or without 10 mug and ml collagen i and incubate at 37degreesc for 3 h .
334						the cell be lyse directly on dish with ice-cold cell lysis buffer .
335						measurement of the activity of beta1 integrin by elisa
336						measurement of the activity of beta1 integrin by elisa under detergent-free condition be perform as describe previously .
337						"105 cell transfect in 24-well plastic culture plate be detach with 1.5 mm edta in PBS , wash three time with serum-free medium , and resuspend in 1 ml dme contain 1 % bsa , with or without sema4d-fc ."
338						"one tenth of the resuspended cell ( 100 mul ) be seed onto the 96-well assay plate , which be coat with 10 mug and ml of either fibronectin or collagen i. cell adhesion be allow for 15 min at 37degreesc ."
339						"then , the cell be delicately wash once with PBS and the adherent cell be fix with 4 % pfa ."
340						"after the fixative , the cell be thoroughly rinse with PBS contain 0.1 % bsa ."
341						"to avoid nonspecific binding , the cell be incubate with PBS contain 5 % bsa for 3 h at RT. ."
342						cell be then incubate overnight at 4degreesc with 2 mug and ml huts-4 .
343						"after the incubation with primary antibody , the well be rinse and block with PBS contain 5 % bsa for 3 h at rt before they be expose to a hrp- conjugate secondary antibody ."
344						"after the incubation , cell be rinse again with PBS follow by distil h2o ."
345						"the peroxidase color reaction be develop in the dark use o-phenylenediamine accord to the manufacturer 's instruction ( elisa OPD kit ; Nacalai Tesque ) , and the plate be read on a kinetic microtiter plate reader ( genio ; Tecan ) use the xfluor4 program ( Tecan ) ."
346						the antibody concentration and incubation time be optimize to ensure testing in the linear range .
347						expression level of the construct use in the assay be also verify by immunoblot analysis .
348						flow cytometry analysis
349						analysis of cell surface expression of active beta1 integrin by flow cytometry be perform as describe previously .
350						106 pc12 cell be seed onto 6-cm noncoated plate in rpmus 1640 contain 10 % h and 5 % fb .
351						"18 h after seed , cell be treat with medium contain sema4d-fc or sema4d-fc plus 1 mm mn2+ for 3 h at 37degreesc ."
352						cell be wash once with PBS and resuspend in block solution contain 5 % dissociation buffer ( Invitrogen ) and 2 % sheep serum in PBS .
353						"cell be then incubate with 2.5 mug huts-4 or buffer alone for 1 h at 4degreesc , wash with the block solution , and label with fitc conjugate secondary antibody for 30 min at 4degreesc ."
354						cell be then wash and analyze with a epics elite flow cytometer use the expo32 analysis program ( Beckman Coulter ) .
355						"for the analysis of active beta1 integrin in transiently transfect cos-7 cell , 106 cell be transfect with a gfp expression vector together with various other expression vector ."
356						"cell be keep for 18 h in dme contain 10 % fb after transfection , stimulate for 5 min at 37degreesc with or without sema4d-fc , and be collect and incubate with huts-4 antibody or buffer alone as describe previously in this section ."
357						"cell be label with a pe conjugate secondary antibody , and expression of gfp and activity of beta1 integrin ( pe staining ) be simultaneously analyze by two-color flow cytometry ."
358						analysis of the intensity of pe staining in a gfp positive population be perform as describe previously .
359						"approximately 10,000 cell be analyze in each experiment , and the result show be representative of two independent experiment ."
360						measurement of r-ra activity
361						measurement of r-ra activity in cell be perform as describe previously .
362						7 x 105 cos-7 cell be maintain in dme contain 1 % fb after transfection .
363						the cell suspension be prepare as describe ( see Measurement of the activity of beta1 integrin by immunoprecipitation ) and plate onto plastic dish coat with or without 10 mug and ml fibronectin and incubate at 37degreesc for 15 min .
364						"the cell be lyse directly on dish with ice-cold cell lysis buffer ( 25 mm hepes-naoh , ph 7.5 , 150 mm nacl , 1 % np-40 , 0.25 % sodium deoxycholate , 0.1 % sd , 10 % glycerol , 10 mm mgcl2 , 1 mm edta , 1 mm dtt , 10 mug and ml aprotinin , and 10 mug and ml leupeptin ) contain 75 mug of gst fuse ra binding domain of c-raf-1 ( gst-rbd ) ."
365						"to examine the effect of collagen i and sema4d stimulation on r-ra activity in pc12 cell , 106 cell be maintain in rpmus 1640 contain 1 % h for 12 h , detach with 1.5 mm edta in PBS , wash three time with serum-free medium , and resuspend in 10 ml of 1 % bsa in rpmus 1640 with or without sema4d-fc ."
366						"for sample indicate , cell be treat with 5 mug and ml of monoclonal beta1 integrin block ( p5d2 ) or activate ( 8a2 ) antibody before replate ."
367						cell be either keep in suspension or plate onto 6-cm plate coat with ( 1 or 10 mug and ml ) or without collagen i and incubate at 37degreesc for 15 min .
368						"the cell be lyse directly on dish with ice-cold cell lysis buffer , and the lysate be use in a pull-down assay use gst-rbd ."
369						detection of fak tyrosine phosphorylation
370						detection of tyrosine phosphorylation of fak be perform as describe elsewhere .
371						"the cell be lyse directly on dish with ice-cold cell lysis buffer ( 50 mm tris-hcl , ph 7.5 , 150 mm nacl , 1 % Triton x-100 , 0.25 % sodium deoxycholate , 10 % glycerol , 1 mm sodium vanadate , 25 mm naf , 10 mug and ml pepstatin , 1 mm pmsf , 10 mug and ml aprotinin , and 10 mug and ml leupeptin ) contain 4 mug and ml of the polyclonal antibody against FAK , immunoprecipitate for 2 h , and subsequently incubate with protein a-sepharose bead ( GE Healthcare ) for 1 h at 4degreesc ."
372						detection of akt serine phosphorylation
373						COS-7 cell be maintain in dme with 0.5 % fb after transfection for 36 h .
374						we add 20 mum ly294002 directly to the culture medium after transfection and change it at every 12 h to reduce the basal level of pi3-k activity .
375						cell be directly lyse on dish with 1x laemmlus sample buffer and analyze by sds-page and immunoblotting .
376						online supplemental material
377						fig .
378						s1 show reduction in endogenous r-ras protein by rna interference in pc12 cell and requirement of endogenous r-ras protein in collagen mediated pc12 cell migration .
379						online supplemental material be available at http://www.jcb.org/cgi/content/full/jcb.200508204/dc1 .
380						Supplementary Material
381						[ Supplemental Material Index ]
