285						These findings suggest that Sema3B mediates the tumor suppressor functions of p53 , which is often diminished in gliomas .
286						Hyperactivation of Ras and its downstream signaling cascades is another commonly observed genetic lesion in different cancers including gliomas .
287						Oncogenic mutations of B-Raf , one of the effectors of Ras is prevalent in melanomas and other cancers but is rarely detected in gliomas , which when present are mainly restricted to high-grade malignant glioblastomas .
288						In gliomas , gain in copy number is more common than mutations for Ras and Raf , though both forms of deregulation lead to activation of the MEK and ERK pathway .
289						Interestingly , constitutive B-Raf/MEK/ERK signaling was found to be associated with a downregulation of plexin-B1 transcript in melanoma .
290						Restoring plexin-B1 expression in melanoma cells is sufficient to suppress anchorage independent growth in vitro and inhibit tumor growth in xenograft transplants in nude mice .
291						The antitumorigenic effect of plexin-B1 is dependent on its R-RasGAP activity and is associated with AKT inactivation .
292						While R-Ras is less oncogenic than other Ras , its deregulation in gliomas is known to promote migration and invasion behaviors .
293						It is plausible that the antitumorigenic functions of plexin-B1 observed in melanoma are adopted in gliomas as well .
294						8 .
295						Concluding Remarks
296						Gliomas are known to exhibit not only histological heterogeneity but also variations in genetic alterations both inter- and intratumorally .
297						These have led to the proposition to incorporate molecular signature to classical histopathological diagnosis so as to provide a more informative description of the features of different glioma types .
298						Here , an overview of various signaling pathways commonly deregulated in gliomas was presented .
299						Despite our increasing knowledge of how these oncogenic pathways interact in a complex manner to contribute to aberrant cell proliferation , resistance to apoptotic cell death , enhanced migration and invasion , and induction of angiogenesis in glioma cells , the options of clinical treatment are still currently largely limited to a combination of surgical resection , followed by radiotherapy or chemotherapy using nonspecific alkylating agents such as temozolomide .
300						While a number of inhibitors and antibodies that suppress the activities of deregulated kinases such as EGFR , c-MET , PDGFR , and PI3K are currently in difference phases of preclinical characterizations or clinical trials , the outcomes show great variations and are complicated by toxicity associated with the agents .
301						The emerging roles of semaphorins and their receptors in the regulation of gliomagenesis and progression therefore represent potential novel candidate targets .
302						Given the engagement of plexins with some of the oncogenic receptor tyrosine kinases such as c-Met and ErbB2 as coreceptors , a better understanding of the crosstalk between these signaling networks is required .
303						Supported by the recent success in detecting MGMT methylation level in glioblastoma patients to predict their sensitivity to chemoradiotherapy using alkylating agents , future direction in clinical management of gliomas , which are heterogeneous in nature , is to define the molecular and genetic profile of the tumor in individual patient so as to devise a customized regimen of treatments .
304						Figure 1
305						Semaphorins and their receptors .
306						Schematic diagram to illustrate the structural features of different classes of semaphorins , plexins and neuropilins .
307						Members of class 2 and 3 semaphorins are secreted , whereas semaphorins 1 , 4-6 are single-pass transmembrane proteins .
308						Class 7 semaphorin is membrane bound via a GPI-anchor .
309						All known semaphorins and plexins are characterized by the presence of a sema domain at the amino-terminus .
310						While semaphorins are structurally diverse , plexin members are well conserved and feature PSI and IPT domains in the extracellular moiety , and a split intracellular GTPase activating protein ( GAP ) domain .
311						Plexin-Bs are distinctive by the presence of a PDZ domain binding site at the C-terminus .
312						Neuropilins are transmembrane receptors that feature two complement binding ( CUB ) domains and FV and FVIII coagulating factor like domain , and a MAM domain in the extracellular portion .
313						Ig , immunoglobulin like ; TM , transmembrane domain ; CD , cytoplasmic domain .
314						Figure 2
315						Signaling cascades mediated by plexin-A and plexin-B , and their crosstalk with oncogenic pathways in gliomas .
316						Plexin-As serve as coreceptors for neuropilins to transduce signals of class 3 semaphorins .
317						Fyn is activated upon semaphorin stimulation , which phosphorylates cyclin dependent kinase-5 ( Cdk5 ) and in turn collapse response mediator protein ( CRMP ) .
318						Cdk5 also phosphorylates isoform A of phosphatidylinositol 3-kinase enhancer ( PIKE-A ) , which is a pro-oncogenic and antiapoptotic factor that activates AKT and promotes glioma cell growth , migration , and invasion .
319						Stimulation of plexin-B with semaphorins causes recruitment of active Rac1 to the Cdc42 and Rac interactive binding ( CRIB ) domain in the cytoplasmic tail , leading to sequestration of Rac1-GTP from its effector p21 activated kinase ( PAK ) and suppression of its downstream signalings .
320						Stimulation of plexin-B also promotes the recruitment of Rac1 to Rho GDP dissociation inhibitor ( RhoGDI ) alpha , which sequesters Rac1 and shuttles it from the membrane to the cytosol to prevent activation .
321						The PDZ domain binding motif at the C-terminus of plexin-B interacts with PDZ domain containing Rho guanine nucleotide exchange factors ( PDZ-RhoGEF ) , which promotes RhoA activation .
322						RhoA-GTP can signal to Raf and activate the MAPK pathway .
323						The GTPase activating protein ( GAP ) domain in the cytoplasmic tail of plexin-A and -B is activated upon semaphorin stimulation and Rnd1 binding , leading to inactivation of R-Ras and PI3K signaling but derepression of PTEN activities .
