156						An upregulation of Sema3E transcript has been observed in metastatic human lung adenocarcinoma cells .
157						Expression of Sema3E induces lung metastasis of mammary adenocarcinoma and promotes migration and growth of endothelial cells .
158						While the importance of semaphorins in cancer development is most well characterized in secreted class 3 members , transmembrane semaphorins of class 4 , 5 , and 6 begin to emerge as important players .
159						Sema4D is highly expressed in cell lines derived from head and neck squamous cell carcinomas ( HNSCCs ) .
160						When shed from HNSCC cells , Sema4D stimulates endothelial cell migration .
161						Silencing Sema4D expression by lentiviral shRNA dramatically reduces the size and vascularity of HNSCC tumor xenografts .
162						These findings suggest the angiogenic function of Sema4D .
163						An overexpression of Sema4D was found to be significantly correlated with lymph node and distant metastasis of pancreatic ductal adenocarcinoma .
164	tissuelist:TS-0739	pancreatic cancer cells	e50,e51,e52,c2	c2	 Sema4D triggers its receptor plexin-B1 and leads to the promotion of invasiveness through activation of the MAPK and the AKT pathway .	In vitro experiments revealed that stimulation of pancreatic cancer cells with Sema4D triggers its receptor plexin-B1 and leads to the promotion of invasiveness through activation of the MAPK and the AKT pathway .
165						In prostate cancers , a significant upregulation of both Sema4D and plexin-B1 has been observed .
166						Mutations have also been found in plexin-B1 that causes an impairment of its R-RasGAP activity , hence increasing cell motility and invasion .
167						In contrast to these oncogenic roles of Sema4D , however , various lines of evidence point to a tumor suppressor role of its receptor plexin-B1 .
168						For instance , a loss of plexin-B1 expression is associated with poor prognosis in ER+ breast cancer patients .
169						Plexin-B1 downregulation is also seen in renal cell carcinoma .
170	tissuelist:TS-0614	melanoma cells	e53,c3	c3	Tumor suppressor function of plexin-B1 has been demonstrated in melanoma cells , and its expression is downregulated by oncogenic B-Raf signaling via MEK and ERK pathway .	Tumor suppressor function of plexin-B1 has been demonstrated in melanoma cells , and its expression is downregulated by oncogenic B-Raf signaling via MEK and ERK pathway .
171						Divergent functions in cancer development is also implicated in class 6 semaphorins .
172						Sema6A inhibits both bFGF and VEGF and tumor cell line induced neovascularization , whereas an upregulation of Sema6D expression is associated with the development of gastric carcinoma .
173	tissuelist:TS-0614	melanoma cells	e54,c4	c4	A recent study has revealed the role of Sema7A in inhibiting cancer cell invasion by inactivation of cofilin through plexin-C1	A recent study has revealed the role of Sema7A in inhibiting cancer cell invasion by inactivation of cofilin through plexin-C1 , which is consistent with the observation of a downregulation of Sema7A in metastatic melanoma cells .
174						Among other members , class 5 semaphorins are peculiar due to the presence of thrombospondin repeats in the extracellular domain , which have been implicated in cancer cell motility and proliferation .
175	tissuelist:TS-0739,tissuelist:TS-1224,tissuelist:TS-0978	pancreatic cancer, prostate cancer, gastric cancer	e55,t2,t3,t4	t2,t3,t4	The expression of semaphorin 5A ( Sema5A ) and its receptor plexin-B3	The expression of semaphorin 5A ( Sema5A ) and its receptor plexin-B3 was shown to be associated with the aggressive nature of pancreatic , prostate , and gastric cancers [ - ] .
176						Nonetheless , a recent report has demonstrated significant downregulation of Sema5A transcript and protein in nonsmall cell lung carcinoma , which correlates with poor survival of the patients , suggesting potential anticancer effect of Sema5A .
177						Consistent with this is a recent study that reports the presence a novel missense mutation in plexin-B3 in human pancreatic ductal adenocarcinomas , which prevents interaction with its ligand Sema5A , hence impairing their signaling and contributing to tumor progression .
178						4.3 .
179						Semaphorins and Their Receptors in Gliomagenesis
180						The implication of semaphorins , neuropilins , and plexins in gliomagenesis was suggested by their presence in human glioma cells .
181						In particular , the downregulation of Sema6B expression in two human glioblastoma cell lines when treated with retinoic acid , an antitumor and differentiation inducing agent suggest its involvement in tumor formation .
182						To date , class 3 semaphorins remain the most well characterized subfamily in the development of gliomas .
183						An increase in expression of the Sema3B gene was found to be associated with poor prognosis and survival of glioma patients .
184						Yet a later study reported the opposite by demonstrating positive correlations of Sema3B , Sema3G and neuropilin-2 with prolonged survival in glioma patients .
185						Similarly , a protumorigenic role of Sema3A was implicated by its overexpression in human GBM specimens , which acts in an autocrine fashion to promote glioma cell dispersal through neuropilin-1 .
186						Silencing Sema3A expression by RNA interference resulted in a significant suppression in migration and an alteration in glioma cell morphology in a Rac1 dependent manner .
187						Nonetheless , it should be noted that Sema3A exhibits an antiangiogenic effect in meningiomas , as evident by the correlation of its high expression with reduced tumor vascularization .
188						Recurrence of meniginomas is often associated with a decline in Sema3A expression .
189	tissuelist:TS-0416	glioma cell	e56,c5	c5	Sema3A , in vitro data revealed that Sema3F inhibits glioma cell migration via RhoA inactivation by p190 RhoGAP .	In contrast to Sema3A , in vitro data revealed that Sema3F inhibits glioma cell migration via RhoA inactivation by p190 RhoGAP .
190						Frequent deletion of 3p21 in gliomas , where the Sema3F gene resides could abolish its effect in counteracting tumor cell motility .
191						In a related study , low level of Sema3F expression was observed in highly metastatic human tumor cell lines due to Id2 mediated repression of gene transcription , which possibly accounts for the enhancement of tumor cell migration and invasion .
192						Similarly , an overexpression of or an exogenous stimulation by Sema3G in human U251 glioma cells is sufficient to inhibit migration and invasion , suggesting a cell autonomous or paracrine mechanism .
193						Recently , Sema5A has been shown to suppress human glioma cell migration and invasion in a plexin-B3- and Rac1 dependent manner .
194						A downregulation of Sema5A protein is found from low- to high-grade gliomas .
195						Notably , stimulation of human glioblastoma cells with Sema5A promotes their differentiation from anaplastic to astrocytic morphology , which is reminiscent of the less pleomorphic and well differentiated features associated with low-grade astrocytomas .
196						Taken together , these findings suggest a tumor suppressor role of Sema5A , which is compromised towards high-grade glioblastomas .
197						In addition to semaphorins , there has been evidence pointing to the importance of neuropilins in glioma development .
198						Analyses of human glioma specimens revealed a significant correlation of Nrp-1 expression with glioma progression to high grades .
199						An upregulation of Nrp-1 in glioma cells was found to promote tumor growth and angiogenesis in vivo .
200						These effects are mediated through the promotion of c-Met phosphorylation , hence potentiating the autocrine HGF and c-Met signaling pathway .
201						5 .
202						Semaphorin and Plexin Signalings
203						Semaphorins and their receptors are inarguably involved in the progression of a large number of cancer types , with functions ranging from cell migration , invasion , metastasis , proliferation , and apoptosis , to angiogenesis .
204						It is not uncommon that many semaphorins can induce pro- and antitumorigenic effects in different cancers , making it a challenging task to decipher the underlying mechanisms of these activities .
205						For instance , Sema3B induces apoptosis in lung and breast cancer but is associated with poor prognosis and survival of glioma patients .
206						Sema3A promotes glioblastoma cell dispersal but inhibits angiogenesis in meningiomas .
207						Possible reasons for these diversities could be attributable to cross-interactions between different subfamilies of semaphorins and plexins , which show differential binding affinity and specificity , thereby triggering different sets of signaling events and functions .
208						A second level of regulation is attained by coupling plexins and and or neuropilins to various coreceptors expressed in a cell- or tissue specific manner , such as neuropilins , L1-cell adhesion molecule , c-Met proto-oncogene , the receptor tyrosine kinase ErbB2 , and PDGFR .
209						This could potentially elicit a more diverse network of signaling events .
210						5.1 .
211						Plexin-A Signaling Regulates PI3K Pathway
212			e57,e58,e59	c6	Sema3A signaling involves phosphorylation of plexin-As by nonreceptor tyrosine kinases Fes and Fps and Fyn .	Sema3A signaling involves phosphorylation of plexin-As by nonreceptor tyrosine kinases Fes and Fps and Fyn .
213			e60	c6	Fyn , a member of the Src family of tyrosine kinases , associates with and phosphorylates plexin-A2 in response to Sema3A .	Fyn , a member of the Src family of tyrosine kinases , associates with and phosphorylates plexin-A2 in response to Sema3A .
214			e61	c6	Active Fyn then phosphorylates cyclin dependent kinase-5 ( Cdk5 ) .	Active Fyn then phosphorylates cyclin dependent kinase-5 ( Cdk5 ) .
215	uaz:UA-ORG-623,tissuelist:TS-0417	neurons, glioblastoma cell	e62,e63,e64,c7,c6	c6,c7	While activated Cdk5 is classically known to phosphorylate CRMP-2 ( collapse response mediator protein ) |  a recent report has shown that Cdk5 mediated phosphorylation of PIKE-A ( Isoform A of phosphatidylinositol 3-kinase enhancer ) , a novel pro-oncogenic and antiapoptotic factor that activates AKT	While activated Cdk5 is classically known to phosphorylate CRMP-2 ( collapse response mediator protein ) in neurons and leads to growth cone collapse , a recent report has shown that Cdk5 mediated phosphorylation of PIKE-A ( Isoform A of phosphatidylinositol 3-kinase enhancer ) , a novel pro-oncogenic and antiapoptotic factor that activates AKT and promotes cancer cell growth , induces glioblastoma cell migration and invasion .
216						These signalings are consistent with the protumorigenic role of Sema3A in promoting glioma cell dispersal .
217			e65	c7	hyperactivated EGFR signaling in glioblastoma patients also recruits Fyn kinase	Interestingly , a recent report has provided in vivo evidence that hyperactivated EGFR signaling in glioblastoma patients also recruits Fyn kinase to enhance tumor survival , growth and invasion .
218						5.2 .
219						Plexin-B Signaling Regulates RhoGTPases
220			e66,e67	c8	Stimulation of plexin-B1 with Sema4D has been shown to recruit active Rac1 to the Cdc42 and Rac interactive binding ( CRIB ) domain in the cytoplasmic tail .	Stimulation of plexin-B1 with Sema4D has been shown to recruit active Rac1 to the Cdc42 and Rac interactive binding ( CRIB ) domain in the cytoplasmic tail .
221			e68	c8	This leads to sequestration of Rac1-GTP from its downstream effector p21 activated kinase ( PAK ) 	This leads to sequestration of Rac1-GTP from its downstream effector p21 activated kinase ( PAK ) , hence suppressing Rac1 mediated functions such as cell migration and proliferation .
222						A recent report that investigates the significance of Sema5A and plexin-B3 in glioma has also shown their suppression of Rac1 activation , though through a different mechanism .
223			e69,e71	c8	Sema5A stimulation of plexin-B3 promotes the recruitment of Rac1 to Rho GDP dissociation inhibitor ( RhoGDI ) alpha , which is a negative modulator that sequesters small GTPases and shuttles them from membrane to the cytosol to prevent activation .	Sema5A stimulation of plexin-B3 promotes the recruitment of Rac1 to Rho GDP dissociation inhibitor ( RhoGDI ) alpha , which is a negative modulator that sequesters small GTPases and shuttles them from membrane to the cytosol to prevent activation .
224	tissuelist:TS-0416	glioma cell	c8			The inactivation of Rac1 was confirmed to contribute to Sema5A induced impediment of glioma cell migration and invasion , as evident by the abolishment of effect upon forced expression of a constitutively active Rac1 mutant .
225			e72	c8	plexin-Bs are also involved in the regulation of RhoA activation .	In addition to Rac1 , plexin-Bs are also involved in the regulation of RhoA activation .
226			e73	c8	Plexin-B members are peculiar to feature a PDZ domain binding motif at their carboxyl terminus .	Plexin-B members are peculiar to feature a PDZ domain binding motif at their carboxyl terminus .
227			e74,e75	c8	A number of studies have demonstrated direct interaction of plexin-B1 with two PDZ domain containing Rho guanine nucleotide exchange factors ( RhoGEF ) , namely , PDZ-RhoGEF and leukemia associated RhoGEF ( LARG ) [ - ] .	A number of studies have demonstrated direct interaction of plexin-B1 with two PDZ domain containing Rho guanine nucleotide exchange factors ( RhoGEF ) , namely , PDZ-RhoGEF and leukemia associated RhoGEF ( LARG ) [ - ] .
228			e76	c8	Stimulation of plexin-B1 by Sema4D leads to RhoA activation in a PDZ-RhoGEF and LARG dependent manner , causing remodeling of actin cytoskeleton that is important for the regulation of cell morphology and cell motility .	Stimulation of plexin-B1 by Sema4D leads to RhoA activation in a PDZ-RhoGEF and LARG dependent manner , causing remodeling of actin cytoskeleton that is important for the regulation of cell morphology and cell motility .
229			e77,e78	c8	Notably , Sema4D is known to activate the MAPK pathway , which is dependent on the C-terminus of plexin-B1 and LARG mediated activation of RhoA .	Notably , Sema4D is known to activate the MAPK pathway , which is dependent on the C-terminus of plexin-B1 and LARG mediated activation of RhoA .
230			e780	c8	In fact , RhoA-GTP was formerly shown to signal to Raf to activate MAPK cascade .	In fact , RhoA-GTP was formerly shown to signal to Raf to activate MAPK cascade .
231					Taken together , this provides a link between the signalings mediated by Sema4D and MAPK .	Taken together , this provides a link between the signalings mediated by Sema4D and MAPK .
232						However , it should be emphasized that the activation of RhoA through PDZ-RhoGEF represents a specific mode restricted to members of the plexin-B subfamily due to the exclusive presence of PDZ domain binding motif in their C-terminus .
233						On the other hand , there is also opposing evidence that indicates the role of Sema4D in RhoA inactivation instead .
234			e79,e80	c8	Stimulation of plexin-B1 with Sema4D was found to promote the binding of plexin-B1 with p190-RhoGAP , which inactivates RhoA and leads to disassembly of focal adhesions .	Stimulation of plexin-B1 with Sema4D was found to promote the binding of plexin-B1 with p190-RhoGAP , which inactivates RhoA and leads to disassembly of focal adhesions .
235			e81,e82,e83	c8	Interestingly , the GAP activity of p190-RhoGAP is enhanced by direct interaction with the constitutively active small GTPase Rnd1 , which also binds to the intracellular domain of plexin-B1 .	Interestingly , the GAP activity of p190-RhoGAP is enhanced by direct interaction with the constitutively active small GTPase Rnd1 , which also binds to the intracellular domain of plexin-B1 .
236						It remains to be determined whether plexin-B1 serves as a docking site to facilitate p190-RhoGAP activation by Rnd1 or instead functions as a negative regulator by sequestering Rnd1 from p190RhoGAP .
237						5.3 .
238						Plexin Singaling Regulates Ras Activity
239						Sequence analysis of plexins revealed the presence of weakly conserved RasGAP motifs in the cytoplasmic domain .
240						A closer examination revealed two subdomains C1 and C2 which harbor the primary arginine ( Arg ) finger and the secondary Arg and Lys motif , respectively , which are highly conserved in the catalytic domain of GAPs and are essential for promoting the GTP hydrolytic activity of target GTPases .
241						The intervening region between C1 and C2 encompasses the binding site for active Rac1 and constitutively active Rnd1 .
242						In basal state , C1 and C2 domains in plexin-B1 undergo intramolecular interaction that prevents their association with Ras .
243			e84,e85	c9	 allows the plexin-B1-Rnd1 complex to interact with R-Ras .	Rnd1 binding to the linker region relieves the closed conformation and allows the plexin-B1-Rnd1 complex to interact with R-Ras .
244			e86,e87	c9	However , RasGAP activity is not triggered until Sema4D binds to Rnd-1-bound plexin-B1 , which causes dimerization of the receptor .	However , RasGAP activity is not triggered until Sema4D binds to Rnd-1-bound plexin-B1 , which causes dimerization of the receptor .
245	uaz:UA-ORG-623	hippocampal neurons	e870,c9	c9	The inactivation of R-Ras by GAP activity of plexin-B1	The inactivation of R-Ras by GAP activity of plexin-B1 contributes to the inhibition of neurite outgrowth and growth cone collapse in hippocampal neurons by Sema4D .
246						Notably , this GAP domain is conserved throughout all plexin families and has been shown to mediate repulsion of axon outgrowth induced by Sema3A and plexin-A1 as well .
247			e88,e89	c8	In contrast to other Ras family members that are commonly deregulated in gliomas , R-Ras only weakly activates Raf and the MEK and ERK pathway .	In contrast to other Ras family members that are commonly deregulated in gliomas , R-Ras only weakly activates Raf and the MEK and ERK pathway .
248						Instead , R-Ras stimulates PI3K and AKT with an efficiency comparable to that of Ras .
249	tissuelist:TS-0592	breast carcinoma cell	c10			R-Ras has been shown to promote breast carcinoma cell migration and invasion in a PI3K- and integrin dependent manner .
250			e90,e91	c10	Inactivation of R-Ras by the RasGAP activity of plexin-B1 triggered by Sema4D was shown to cause an inhibition of cell migration through suppression of PI3K and beta1 integrin activity .	Inactivation of R-Ras by the RasGAP activity of plexin-B1 triggered by Sema4D was shown to cause an inhibition of cell migration through suppression of PI3K and beta1 integrin activity .
251			e94,e95	c10	Recently , there has been evidence to show that the inactivation of R-Ras by Sema4D induced RasGAP activity of plexin-B1 leads to PTEN dephosphorylation , thereby activating its inhibitory effect on PI3K signaling .	Recently , there has been evidence to show that the inactivation of R-Ras by Sema4D induced RasGAP activity of plexin-B1 leads to PTEN dephosphorylation , thereby activating its inhibitory effect on PI3K signaling .
252			e92,e93	c10	This provides a plausible mechanism by which plexin-Bs regulates the PI3K and AKT pathway .	This provides a plausible mechanism by which plexin-Bs regulates the PI3K and AKT pathway .
253						While the importance of R-Ras activity regulation by semaphorin and plexin in glioma progression is yet to be scrutinized , increasing R-Ras expression and activation is known to correlate with advanced grades of gliomas and invading glioblastoma cells .
254	uaz:UA-ORG-623	neurons	e96,e97,e98,c11	c11	In addition to R-Ras , Sema4D and plexin-B1 can also suppress M-Ras activity , 	In addition to R-Ras , Sema4D and plexin-B1 can also suppress M-Ras activity , which results in an inhibition of dendritic outgrowth and branching in primary cortical neurons .
255						Remarkably , this signaling was found to induce a suppression of ERK activity , though the mechanism remains known .
256			e99	c12	It is notable that a recent study has reported Rap1 as a novel substrate for the GAP activity mediated by plexin-B1 .	It is notable that a recent study has reported Rap1 as a novel substrate for the GAP activity mediated by plexin-B1 .
257	uaz:UA-CT-30004	astrocytomas	c12			Rap1 overexpression was observed in astrocytomas of all malignancy grades , and was 2 to 3 folds higher in grade IV GBMs than in lower grades or non neoplastic brain .
258						The effect of GAP activity of plexin-B on Rap1 in the control of glioma progression , if any , warrants further investigations .
259						6 .
260						Coupling of Plexin-B with c-Met and ErbB2 as Coreceptors
261						c-Met is a tyrosine kinase receptor that upon stimulation by hepatocyte growth factor and scatter factor ( HGF and SF ) regulates various cellular functions such as cell proliferation , migration , invasion , and morphogenesis through activation of various signalings such as the Ras and the PI3K and AKT pathways .
262						They are commonly overexpressed in gliomas and contribute to enhanced tumorigenicity .
263						An inhibition of endogenous HGF and SF and c-Met in gliomas suppresses the malignant phenotype .
264			e100,e101	c13,c14	To date , all known members of plexin-B subfamily have been shown to interact with c-Met and the related proto-oncogene Ron , even in the absence of their ligands .	To date , all known members of plexin-B subfamily have been shown to interact with c-Met and the related proto-oncogene Ron , even in the absence of their ligands .
265	tissuelist:TS-0564,tissuelist:TS-0161	liver progenitor cell line, colon carcinoma cell line	e102,e103,e104,c13,c14	c13,c14	Binding of Sema4D to plexin-B1 stimulates the tyrosine kinase activity of c-Met and Ron	Binding of Sema4D to plexin-B1 stimulates the tyrosine kinase activity of c-Met and Ron , resulting in tyrosine phosphorylation of both receptors and promotion of invasive response in a liver progenitor cell line and a colon carcinoma cell line .
266						By contrast , a recent study has reported the opposite in melanoma .
267						Sema4D fails to activate c-Met in melanomas , not because of a significant downregulation of plexin-B1 in these cancer cells .
268			e105,e106	c15	Instead , reconstitution of plexin-B1 expression in melanomas inhibits HGF dependent activation of c-Met and migration .	Instead , reconstitution of plexin-B1 expression in melanomas inhibits HGF dependent activation of c-Met and migration .
269						A plausible explanation for this observation could be the competition between plexin-B1 and HGF for c-Met binding .
270	tissuelist:TS-0614	melanoma cells	c15			Importantly , restoring plexin-B1 expression in melanoma cells is sufficient to suppress tumor growth in vivo , suggesting a tumor suppressor role of plexin-B1 .
271						In fact , the contrasting effects of semaphorins and plexins in regulating HGF and c-Met signaling is not unexpected given the ability of plexins to modulate Ras and PI3K as described above .
272			e107,e108	c16	In addition to c-Met , members of the plexin-B family were also found to stably associate with another receptor tyrosine kinase ErbB2 .	In addition to c-Met , members of the plexin-B family were also found to stably associate with another receptor tyrosine kinase ErbB2 .
273			e109,e110	c16	Binding of Sema4D to plexin-B1 stimulates the intrinsic tyrosine kinase activity of ErbB2 , resulting in the phosphorylation of both receptors .	Binding of Sema4D to plexin-B1 stimulates the intrinsic tyrosine kinase activity of ErbB2 , resulting in the phosphorylation of both receptors .
274			e111,e112	c16	ErbB2 mediated phosphorylation of plexin-B1 is important for Sema4D induced activation of RhoA through PDZ-RhoGEF .	ErbB2 mediated phosphorylation of plexin-B1 is important for Sema4D induced activation of RhoA through PDZ-RhoGEF .
275			e113	c16	Contrary to this , Sema4D induces an inactivation of RhoA in a c-Met dependent manner .	Contrary to this , Sema4D induces an inactivation of RhoA in a c-Met dependent manner .
276	tissuelist:TS-0595	breast	e1130,c16	c16	The reciprocal effect of c-Met and ErbB2 in plexin-B1-mediated regulation of RhoA activation status	The reciprocal effect of c-Met and ErbB2 in plexin-B1-mediated regulation of RhoA activation status is believed to partially account for the pro- and antimigratory effects of Sema4D in breast carcinoma and other cancer cells , depending on the relative expression levels of these two receptors .
277						Notably , analysis of astrocytomas of different grades shows no gene amplification of ErbB2 .
278						The expression of ErbB2 protein is weaker than EGFR and is at barely detectable level by Western and immunocytochemistry analysis .
279						The relative importance of c-Met and ErbB2 in the regulation of glioma behaviors by semaphorin and plexin signaling remains to be determined .
280						7 .
281						Regulation of Semaphorins and Plexins by Oncogenic Pathways
282						While semaphorins and plexins impose their pro- and antitumorigenic functions in gliomas through the regulation of various signaling pathways , accumulating evidence suggests that they are also targets for modulation by some of the aberrant oncogenic pathways .
283			e114	c17	The gene encoding for Sema3B for instance , was identified as a direct target of the tumor suppressor gene p5	The gene encoding for Sema3B for instance , was identified as a direct target of the tumor suppressor gene p53 that is commonly mutated in gliomas .
284	tissuelist:TS-0417	glioblastoma cell	c17			Ectopic expression of p53 in a p53 deficient glioblastoma cell line results in dramatic induction of Sema3B mRNA expression and a reduction in the number of colonies in anchorage independent growth assays .
