159						total mrna be use for subsequent reverse transcription use the SuperScript III First-Strand synthesis SuperMix ( Invitrogen ) for cell line and unpaired tumor sample , and the SuperScript VILO cdna synthesis kit ( Invitrogen ) for paired frozen tumor sample .
160						5 microl of the rt reaction be use for quantitative pcr use SYBR Green pcr master Mix and gene specific primer , in triplicate , use a ABI 7300 real Time pcr system .
161						primer use for detection be as follow ; COT forward : 5 '- CAA GTG AAG AGC cag cagttt -3 ' ; COT reverse : 5 '- gca agc aaatcc tcc aca gtt c -3 ' ; tbp forward : 5 '- CCC GAA ACG CCG AAT ata atc c -3 ' ; tbp reverse : 5 '- gac tgt TCT TCA CTC TTG gct c -3 ' ; gapdh forward : 5 '- cat cat CTC TGC CCC CTC t -3 ' ; gapdh reverse : 5 ' - GGT gct aag cag ttg gtg gt -3 ' .
162						in vitro kinase assay
163						in vitro kinase assay be perform as previously describe use 1 microg each of COT ( amino acid 30-397 , R&D Systems ) and inactive erk1 ( Millipore ) .
164						cellular viability assay
165						adherent rpmi-7951 cell be infect with virus express shrna against COT or Luciferase as describe above .
166						follow selection , cell be plate ( 1.5 x105 cell and well ) onto a 24-well plate in quadruplicate .
167						viable cell be count via trypan blue exclusion use a vi-cell cell Viability Analyzer , per manufacturer 's specification .
168						quadruplicate cell count be average and normalize relative to that of the control shrna .
169						the cancer cell line encyclopedia ( ccle )
170						the cancer cell line encyclopedia ( ccle ) project be a collaboration between the Broad Institute , the Novartis Institutes for Biomedical Research ( nibr ) and the Genomics Institute of the Novartis Research Foundation ( GNF ) to conduct a detailed genetic and pharmacologic characterization of a large panel of human cancer model , to develop integrated computational analysis that link distinct pharmacologic vulnerability to genomic pattern and to translate cell line integrative genomic into cancer patient stratification .
171						all oncomap mutation datum and snp-array derive copy number datum be available online at www.broadinstitute.org/ccle .
172						expression profiling of cancer cell line
173						we carry out oligonucleotide microarray analysis use the GeneChip Human Genome U133 Plus 2.0 Affymetrix expression array ( Affymetrix , Santa Clara , CA ) .
174						sample be convert to label , fragmented , crna per the Affymetrix protocol for use on the expression microarray .
175						shrna construct use ( plko .1 )
176						Supplementary Material
177						1
178						figure
179						Figure 1
180						a orf base functional screen identify COT and c-raf kinase as driver of resistance to b-raf inhibition
181						overview of the CCSB and Broad Institute kinase orf collection .
182						kinase classification and number of kinase per classification be noted.a375 express the CCSB and Broad Institute kinase orf collection be assay for relative viability in 1 microm plx4720 and normalize to constitutively active mek1 ( mek1dd ) .
183						nine orf ( orange circle ) score 2 standard deviation ( red dash line , 58.64 % ) from the mean of all orf ( green dash line , 44.26 % ) .
184						indicate orf be express in 5 b-rafv600e cell line and treat with dmso or 1 microm plx4720 .
185						viability ( relative to dmso ) be quantify after 4 day .
186						error bar represent standard deviation between replicate ( n = 6 ) .
187						figure 2
188						resistance to b-raf inhibition via mapk pathway activation
189						indicate orf be express in a375 .
190						level of phosphorylate mek and erk be assay follow 18 h. treatment with dmso ( - ) or plx4720 ( concentration note ) .
191						proliferation of a375 express indicate orf .
192						error bar represent standard deviation between replicate ( n = 6 ) .
193						C-RAF ( s338 ) and erk phosphorylation in lysate from a375 express indicate orfs.cot expression in lysate from immortalize primary melanocyte express brafv600e or empty vector .
194						cot mrna have a internal start codon ( 30M ) result in two protein product of different length ; amino acid 1-467 or 30-467 , note with arrows.cot and erk phosphorylation in lysate from a375 express indicate orf follow shrna mediate b-raf depletion ( shbraf ) relative to control shrna ( shluc ) .
195						erk phosphorylation in lysate from a375 express indicate orf follow shrna mediate c-raf depletion ( shcraf ) or control shrna ( shluc ) , follow 18 h. treatment with dmso ( - ) or 1 microm plx4720 ( + ) .
196						Figure 3
197						cot expression predict resistance to b-raf inhibition in cancer cell line
198						map3k8 and cot copy number ; red bar : COT amplification , blue bar : non amplify cot.cot expression in b-rafv600e cell line andshort-term cultures.plx4720 gi50 in b-rafv600e cell line .
199						color as in .
200						mek and erk phosphorylation follow treatment with dmso or plx4720 ( concentration indicate ) .
201						erk phosphorylation in m307 lysate ( azd-r ; azd6244 resistant ) treat with dmso or 1 microm plx4720 ( plx ) or ci-1040 ( ci ) .
202						cot mrna expression ( qrt and pcr ) in patient and lesion-matched plx4032 treat metastatic melanoma tissue sample .
203						pt .
204						1 and 3 have multiple biopsy from the same lesion .
205						error bar represent sem ( n = 3 ) .
206						U ; undetermined and undetectable .
207						erk and mek phosphorylation in rpmi-7951 follow shrna mediate COT depletion ( shcot ) versus control ( shluc ) and treatment with dmso ( - ) or 1 microm plx4720 ( + ) .
208						erk and mek phosphorylation be quantified.erk and mek phosphorylation in rpmi-7951 follow 1 h. treatment with a small molecule cot kinase inhibitor .
209						erk and mek phosphorylation be quantify .
210						Figure 4
211						COT express b-rafv600e cell line exhibit resistance to allosteric mek inhibitor
212						CI-1040 gi50 in a panel of b-rafv600e cell line ; red bar : cot expression and amplification , blue bar : undetectable and non-amplified cot.mek and erk phosphorylation in lysate from indicate cell line treat with dmso or ci-1040 ( concentration note ) .
213						fold change ( relative to mek1 ) gi50 of a375 ectopically express the indicated orf for plx4720 , raf265 , ci-1040 and azd6244.erk phosphorylation in a375 express indicate orf follow treatment with dmso or 1 microm of plx4720 , raf265 , ci-1040 or azd6244.viability of a375 express the indicated orf and treat with dmso , plx4720 ( concentration indicate ) and plx4720 in combination with ci-1040 or azd6244 ( all 1 microm ) .
214						error bar represent the standard deviation ( n = 6 ) .
215						erk phosphorylation in a375 express indicate orf follow treatment with dmso , plx4720 ( 1 microm ) or plx4720 in combination with ci-1040 or azd6244 ( all 1 microm ) .
