114	uaz:UA-CLine-100061	mast cells	c26			there be two sphk isoform , but the contribution of each sphk isoform to fcepsilonrus signaling and mast cell activation be controversial .
115						one group have define a intracellular pathway whereby sphk2 generate s1p , which subsequently promote intracellular calcium signaling that result in mast cell degranulation and cytokine production .
116						sphk1 in other cell type generate s1p that be release extracellularly and act on mast cell via the s1p1 and s1p2 receptor to promote mast cell migration and to enhance mast cell degranulation and cytokine production upon fcepsilonrus activation .
117	uaz:UA-CLine-100061	mast cells	e790,e80,e81,c260	c260	on the other hand , datum from other group indicate that sphk1 , as oppose to sphk2 , be the major intracellular source of s1p in mast cell downstream of fcepsilonrus activation .	on the other hand , datum from other group indicate that sphk1 , as oppose to sphk2 , be the major intracellular source of s1p in mast cell downstream of fcepsilonrus activation .
118					these group have also describe role for extracellular s1p in mast cell migration and fcepsilonrus activation via the s1p1 and s1p2 receptor .	these group have also describe role for extracellular s1p in mast cell migration and fcepsilonrus activation via the s1p1 and s1p2 receptor .
119						calcium signaling downstream of fcepsilonrus
120			e82,e83,e84,e85	c27	intracellular calcium signaling contribute to degranulation , eicosanoid production , and cytokine production downstream of fcepsilonrus activation .	intracellular calcium signaling contribute to degranulation , eicosanoid production , and cytokine production downstream of fcepsilonrus activation .
121					fcepsilonrus induce calcium signaling in mast cell occur in two step , the first be release of calcium from intracellular calcium store in the er and the second be calcium influx from the extracellular space through store operate calcium channel .	fcepsilonrus induce calcium signaling in mast cell occur in two step , the first be release of calcium from intracellular calcium store in the er and the second be calcium influx from the extracellular space through store operate calcium channel .
122			e86	c27	intracellular calcium signaling be regulate by plcgamma , which generate inositol 1,4,5-trisphosphate and diacylglycerol from pip2 .	intracellular calcium signaling be regulate by plcgamma , which generate inositol 1,4,5-trisphosphate and diacylglycerol from pip2 .
123			e87	c27	inositol 1,4,5-trisphosphate stimulate the release of intracellular calcium store upon bind to its receptor in the er .	inositol 1,4,5-trisphosphate stimulate the release of intracellular calcium store upon bind to its receptor in the er .
124					the depletion of er calcium store then trigger extracellular calcium influx .	the depletion of er calcium store then trigger extracellular calcium influx .
125	uaz:UA-CLine-100061	mast cells	c27	c27	diacylglycerol and intracellular calcium signal cooperate to activate pkc	diacylglycerol and intracellular calcium signal cooperate to activate pkc , which then activate other pathway such as the nf-kappab pathway , ultimately lead to mast cell degranulation and cytokine production .
126						we understanding of intracellular calcium signaling have advance significantly in recent year due to the discovery of the identity of key component and regulator of store operate calcium channel .
127						stim1 ( stromal interaction molecule 1 ) be identify as a calcium sensor located in the er that couple the depletion of intracellular er calcium store to the activation of store operate calcium channel .
128						orai1 and cracm1 be a recently discover membrane protein that constitute the store operate calcium channel ( - ) .
129						mutation of orai1 in human result in severe combined immunodeficiency that be due to a lack of store operate calcium channel function .
130						both stim1 and orai1 knock-out mast cell be deficient in intracellular calcium signaling downstream of fcepsilonrus activation due to defective influx of calcium from the extracellular space , lead to defective mast cell degranulation , eicosanoid production , and cytokine production .
131						recent datum indicate that syk be a local sensor of calcium signaling that contribute to a positive feedback loop downstream of store operate calcium channel opening and that also couple extracellular calcium influx to the activation of pkc and other pathway .
132						negative regulator of fcepsilonrus signaling
133						negative regulator of fcepsilonrus signaling can be group into intracellular and cell surface protein that act at various point in the fcepsilonrus signaling network .
134			e88,e89,e90,e91	c28	intracellular negative regulator of fcepsilonrus signaling include the shp-1 and shp-2 phosphatase , which inhibit the activity of signaling protein that be proximal to fcepsilonrus such as syk and fyn and adaptor protein such as lat and ntal .	intracellular negative regulator of fcepsilonrus signaling include the shp-1 and shp-2 phosphatase , which inhibit the activity of signaling protein that be proximal to fcepsilonrus such as syk and fyn and adaptor protein such as lat and ntal .
135			e92	c28	protein-tyrosine phosphatase epsilon be a phosphatase that also act at a proximal point in the fcepsilonrus signaling network by inhibit syk activity .	protein-tyrosine phosphatase epsilon be a phosphatase that also act at a proximal point in the fcepsilonrus signaling network by inhibit syk activity .
136			e93,e94,e95	c28	the pi3k pathway be negatively regulate by ship and pten , which directly dephosphorylate pip3 to generate pip2 .	the pi3k pathway be negatively regulate by ship and pten , which directly dephosphorylate pip3 to generate pip2 .
137			e96,e97	c28	ship dephosphorylate the phosphate at the d5 position of the inositol ring of pip3 , whereas pten dephosphorylate the phosphate at the d3 position .	ship dephosphorylate the phosphate at the d5 position of the inositol ring of pip3 , whereas pten dephosphorylate the phosphate at the d3 position .
138			e98,e99,e100	c28	the pi3k pathway be also negatively regulate by rgs13 and lax , which inhibit the interaction of the pi3k p85 regulatory subunit with the grb2-ntal scaffolding complex .	the pi3k pathway be also negatively regulate by rgs13 and lax , which inhibit the interaction of the pi3k p85 regulatory subunit with the grb2-ntal scaffolding complex .
139						mast cell that be deficient in these negative regulator have heighten degranulation and and or cytokine response downstream of fcepsilonrus activation .
140	uaz:UA-CLine-100061	mast cells	c28, e104,e105,e106,e107,e108,e109,e110	c28	negatively regulate fcepsilonrus activation include trpm4 , which modulate extracellular calcium influx , and tlr4 , which , upon association with the es62 product of filarial nematode , traffic into vesicular compartment , where it sequester and degrade pkcalpha , a protein kinase that mediate pld and sphk activation downstream of fcepsilonrus	cell surface protein on mast cell that negatively regulate fcepsilonrus activation include trpm4 , which modulate extracellular calcium influx , and tlr4 , which , upon association with the es62 product of filarial nematode , traffic into vesicular compartment , where it sequester and degrade pkcalpha , a protein kinase that mediate pld and sphk activation downstream of fcepsilonrus .
141						figure 2 .
142						the fcepsilonrus signaling pathway be negatively regulate by a number of cell surface and intracellular protein that act at various point in the fcepsilonrus signaling network .
143						proximal intracellular fcepsilonrus signaling and adaptor protein be negatively regulate by Csk , protein-tyrosine phosphatase epsilon ( ptpepsilon ) , shp-1 , and shp-2 .
144						pi3k signaling be negatively regulate by ship , pten , lax , and rgs13 .
145						ra signaling be negatively regulate by rasgap .
146						cell surface protein that negatively regulate fcepsilonrus signaling include trpm4 , which reduce calcium signaling , and tlr4 , which , upon formation of a complex with the es62 product of filarial nematode , inhibit sphk and pld signaling by sequester and degrade sphk- and pld activate pkcalpha .
147						co-cross-linking of the itim contain cell surface receptor fcgammariib with fcepsilonrus trigger the inhibition of fcepsilonrus signaling at several point , include ship mediate inactivation of pi3k signaling and dok1 and rasgap-mediated inactivation of ra signaling .
148						co-cross-linking of fcepsilonrus with other itim contain cell surface receptor trigger the inhibition of fcepsilonrus signaling mediate by shp-1 and shp-2 .
149						DAG , diacylglycerol ; ip3 , inositol 1,4,5-trisphosphate .
150	uaz:UA-CLine-100061	mast cells	e1100,e111,e112,e113,c29	c29	a number of cell surface receptor that contain cytoplasmic immunoreceptor tyrosine based inhibition motif ( itim ) be find in mast cell and function to negatively regulate fcepsilonrus activation upon co-engagement with fcepsilonrus by engage endogenous negative regulatory pathway .	a number of cell surface receptor that contain cytoplasmic immunoreceptor tyrosine based inhibition motif ( itim ) be find in mast cell and function to negatively regulate fcepsilonrus activation upon co-engagement with fcepsilonrus by engage endogenous negative regulatory pathway .
151			e114,e115,e116,e117	c29	these itim contain receptor include fcgammariib , pir-b , gp49b1 , myeloid associate immunoglobulin receptor i , mast cell function associate antigen , signal regulator protein alpha , and the recently identify allergin-1 .	these itim contain receptor include fcgammariib , pir-b , gp49b1 , myeloid associate immunoglobulin receptor i , mast cell function associate antigen , signal regulator protein alpha , and the recently identify allergin-1 .
152			e118,e119,e120,e121	c29	the mechanism of fcgammariib mediate inhibition of fcepsilonrus activation have be extensively describe .	the mechanism of fcgammariib mediate inhibition of fcepsilonrus activation have be extensively describe .
153			e122,e123,e124	c29	co-engagement of fcgammariib with fcepsilonrus result in Lyn mediate phosphorylation of the tyrosine residue in the FcgammaRIIb ITIM motif , which subsequently recruit the protein-tyrosine phosphatase ship and the docking protein dok1 to the fcepsilonrus complex .	co-engagement of fcgammariib with fcepsilonrus result in Lyn mediate phosphorylation of the tyrosine residue in the FcgammaRIIb ITIM motif , which subsequently recruit the protein-tyrosine phosphatase ship and the docking protein dok1 to the fcepsilonrus complex .
154			e125,e126	c29	ship be activate by phosphorylation and mediate dephosphorylation of pip3 to generate pip2 , thereby directly inhibit the pi3k pathway .	ship be activate by phosphorylation and mediate dephosphorylation of pip3 to generate pip2 , thereby directly inhibit the pi3k pathway .
155			e127,e128,e129,e1290	c29	dok1 recruit and activate ra gtpase activate protein ( rasgap ) , which inhibit the ra pathway by enhance the intrinsic gtpase activity of ra .	dok1 recruit and activate ra gtpase activate protein ( rasgap ) , which inhibit the ra pathway by enhance the intrinsic gtpase activity of ra .
156			e130	c29	all other itim contain cell surface receptor inhibit fcepsilonrus activation through the action of shp-1 and shp-2 phosphatase .	all other itim contain cell surface receptor inhibit fcepsilonrus activation through the action of shp-1 and shp-2 phosphatase .
157						therapeutic targeting of fcepsilonrus signaling
158						give the clinical efficacy of therapeutic anti-ige neutralization in asthma , which reduce fcepsilonrus activation and have reveal a important role for fcepsilonrus signaling in asthma pathogenesis , future therapy that directly target and inhibit fcepsilonrus signaling have significant potential for the treatment of asthma , especially those therapeutic strategy that lead to a more complete and and or faster inhibition of fcepsilonrus activation compare with anti-ige therapy .
159						several intracellular protein that play key role in fcepsilonrus signaling and mast cell activation and whose therapeutic inhibition may lead to superior efficacy compare with anti-ige therapy have be discuss in this minireview .
160	taxonomy:9606	human	e131,s5	c29,s5	of these , there be significant ongoing effort to generate small molecule inhibitor of syk and pi3k , which have result in some compound that have enter human clinical trial for asthma or other allergic disease .	of these , there be significant ongoing effort to generate small molecule inhibitor of syk and pi3k , which have result in some compound that have enter human clinical trial for asthma or other allergic disease .
161			e132	c29,s5	there have also be recent progress in the generation of specific small molecule inhibitor of Btk .	there have also be recent progress in the generation of specific small molecule inhibitor of Btk .
162						the discovery of stim1 and orai1 have spur effort to identify novel small molecule inhibitor of these component and regulator of store operate calcium channel .
163						a major concern associate with many of these small molecule target be they broad biology beyond fcepsilonrus signaling , which may result in adverse safety profile upon therapeutic targeting .
164						a alternative approach to the intracellular small molecule targeting of fcepsilonrus signaling utilize protein base therapeutics , which be well suit for specifically target cell surface protein .
165						several group have develop protein base therapeutics that directly inhibit fcepsilonrus activation by co-cross-link fcepsilonrus with various cell surface itim contain receptor , most commonly FcgammaRIIb .
166			e133,e134	s5,c29	 ige that be bind to fcepsilonrus and fcgammariib , and various bispecific antibody technology that co-cross-link fcepsilonrus with fcgammariib or other itim contain receptor .	these approach include a ige-fc and igg-fc fusion protein that simultaneously engage fcepsilonrus and fcgammariib , a specific allergen and igg-fc fusion protein that simultaneously engage allergen specific ige that be bind to fcepsilonrus and fcgammariib , and various bispecific antibody technology that co-cross-link fcepsilonrus with fcgammariib or other itim contain receptor .
167						Limitations of several of these protein base therapeutics include poor in vivo pharmacokinetic , immunogenicity , and difficulty associate with large-scale manufacturing , although some new bispecific antibody format can overcome many of these limitation .
168						give the increase development and use of antibody therapeutics for the treatment of disease , include asthma , novel bispecific antibody approach may help expand the scope of therapeutic target in the future .
169						summary
170						a substantial network of signal molecule and adaptor protein that function downstream of fcepsilonrus activation have be define .
171						future study will continue to elucidate the cell and membrane biology of fcepsilonrus signaling , novel cell surface and intracellular mediator of fcepsilonrus activation , mechanism of intracellular calcium signaling , and new inhibitory protein that negatively regulate part of the signaling network downstream of fcepsilonrus activation .
172						we increase understanding of fcepsilonrus signaling may lead to the development of new therapeutics that inhibit fcepsilonrus activation for the treatment of asthma .
