1						family-wide characterization of the denn domain Rab GDP-GTP exchange factor
2						target or substrate rab gtpase be identify for 17 protein with denn domain .
3	taxonomy:9606	human	s1			"a key requirement for rab function in membrane trafficking be site specific activation by gdp-gtp exchange factor ( gef ) , but the majority of the 63 human rab have no known gef ."
4						we have perform a systematic characterization of the 17 human denn domain protein and demonstrate that they be specific gef for 10 rab .
5			"e1,e2,e3,e4"	"s1,c1,c2"	dennd1a and 1b localize to clathrin patch at the plasma membrane and activate rab35 in a endocytic pathway trafficking shiga toxin to the trans-golgi network .	dennd1a and 1b localize to clathrin patch at the plasma membrane and activate rab35 in a endocytic pathway trafficking shiga toxin to the trans-golgi network .
6			e5	"s1,c1,c2"	dennd2 gef target to actin filament and control rab9 dependent trafficking of mannose-6-phosphate receptor to lysosome .	dennd2 gef target to actin filament and control rab9 dependent trafficking of mannose-6-phosphate receptor to lysosome .
7			"e6,e7,e8,e9,e10,e11,e12"	"s1,c1,c2"	"dennd4 gef target to a tubular membrane compartment adjacent to the golgus , where they activate rab10 , which suggest a function in basolateral polarize sorting in epithelial cell that compliment the non DENN GEF sec2 act on rab8 in apical sorting ."	"dennd4 gef target to a tubular membrane compartment adjacent to the golgus , where they activate rab10 , which suggest a function in basolateral polarize sorting in epithelial cell that compliment the non DENN GEF sec2 act on rab8 in apical sorting ."
8			"e13,e14,e15,e16,e17,e18,e19,e20,e21,e22,e23,e24,e25e26,e27,e31"	"s1,c1,c2"	"dennd1c , dennd3 , dennd5a and 5b , mtmr5 and 13 , and MADD activate rab13 , rab12 , rab39 , rab28 , and rab27a and 27b , respectively ."	"dennd1c , dennd3 , dennd5a and 5b , mtmr5 and 13 , and MADD activate rab13 , rab12 , rab39 , rab28 , and rab27a and 27b , respectively ."
9						"together , these finding provide a basis for future study on rab regulation and function ."
10						introduction
11						Rab gtpase be use to encode information about the state of a membrane or membrane domain in order to control specific membrane trafficking event .
12						rab be activate by specific guanine nucleotide exchange factor ( gef ) promote the release of GDP and binding of gtp .
13						"accord to the prevail model , gef together with other regulatory factor localize to and act at specific membrane surface , and thus provide a means to locally activate they target rab ."
14						"this system allow vesicle derive from a particular organelle to be tag with a specific Rab gtpase , and they movement along the cytoskeleton and tethering to a specified domain on a target membrane to be control ."
15						effector protein complex that be either activate or recruit to the membrane surface by the presence of the gtp bind Rab mediate these cytoskeletal and membrane tethering function .
16						gtp hydrolysis trigger either by additional gtpase activate protein ( gap ) or spontaneously because of intrinsic activity of the Rab end the cycle .
17						gef and gap therefore play a key role in the specific activation and inactivation of Rab gtpase .
18						the known Rab gef and gap typically fall into discrete family define by conserve protein domain .
19			e29	s2	Rab gap characteristically contain a tbc domain that catalyze nucleotide hydrolysis by a arginine-glutamine two-finger mechanism .	"with the exception of the rab3gap1 and 2 protein , Rab gap characteristically contain a tbc domain that catalyze nucleotide hydrolysis by a arginine-glutamine two-finger mechanism ."
20	taxonomy:9606	human	"s2,e290"	s2	"in human , the tbc domain family have over 40 member , and it be likely that these regulate all 63 human rab , with some tbc domain protein act on several closely related rab ."	"in human , the tbc domain family have over 40 member , and it be likely that these regulate all 63 human rab , with some tbc domain protein act on several closely related rab ."
21						"Rab gef be more diverse , and several conserve , yet structurally unrelated protein and protein complex have be show to have specific Rab gef activity ."
22	taxonomy:7215	drosophila	"e30,e32,e33,e34,e35,e36,s3"	"s2,s3"	"the TRAPP and I complex activate ypt1p and rab1 , vps9 domain protein activate rab5 and ypt51p subfamily gtpase , sec2p and rabin protein activate sec4p gtpase , the ric1p and rgp1p complex activate ypt6p and possibly rab6 , the mon1p and ccz1p complex act on ypt7p and rab7 | the rcc1 domain protein claret , which may act as a gef for the unique rab lightoid in drosophila ."	"these be : the TRAPP and I complex activate ypt1p and rab1 , vps9 domain protein activate rab5 and ypt51p subfamily gtpase , sec2p and rabin protein activate sec4p gtpase , the ric1p and rgp1p complex activate ypt6p and possibly rab6 , the mon1p and ccz1p complex act on ypt7p and rab7 , and the rcc1 domain protein claret , which may act as a gef for the unique rab lightoid in drosophila ."
23						"apart from claret , these gef and they target Rab gtpase act in trafficking pathway conserve from mammal to yeast ."
24						"however , mammalian cell possess > 60 rab , compare with the 11 of bud yeast , and therefore require additional gef to activate these extra rab ."
25						"at present , most of the 60 mammalian rab lack a defined gef activity , and it be therefore unclear how they would be specifically activate ."
26						additional rab gef be therefore likely to exist .
27						denn domain protein be first implicate as Rab gef by the biochemical purification of a rab3 gef from bovine brain .
28						"this be subsequently identify as a denn domain protein , although it remain unclear which domain in the protein be responsible for gef activity ."
29	"taxonomy:6239"	"caenorhabditis elegan"	"s4,e37,e38"	"s4"	MADD homologue aex-3 be responsible for control the activity of rab3 and rab27	further study reveal that the caenorhabditis elegan MADD homologue aex-3 be responsible for control the activity of rab3 and rab27 at the synapse .
30						"more recently , a screen for defective receptor mediate yolk protein endocytosis in C. elegan identify another denn domain protein rme-4 , and indicate that it act on rab35 ."
31						this be confirm by complementary study in mammalian cell show that the rme-4 homologue dennd1a and connecdenn be in fact a rab35 gef .
32						these finding support the idea that denn domain protein might form a family of Rab gef .
33						"to investigate this , we have characterize the human denn domain protein , and identify they target or substrate rab gtpase ."
34						result
35						identification of human denn domain protein
36						sequence search of the human genome use the denn domain of the rab3 gef MADD reveal the presence of 17 protein share this domain .
37						"all these protein carry a full denn domain comprise the three upstream ( u-denn ) , core ( DENN ) , and downstream ( d-denn ) subregion ."
38						"systematic search of the genome sequence database reveal that although widely conserve in metazoan and protozoan , these DENN domain protein be absent from the bud yeast saccharomyces cerevisiae use as a model for trafficking study ."
39	taxonomy:9606	humans	"e40,s6"	s6	denn domain protein may act as gef for some of the many additional rab	this suggest that denn domain protein may act as gef for some of the many additional rab find in human and other metazoan .
40						"further analysis indicate that in addition to these protein , there be a group of related protein contain partial denn homology ."
41						some of these such as avl9 and its homologue be conserve to bud yeast and other fungus .
42						"because avl9 may be a gef for the non Rab ra family gtpase gtr2 in late golgus trafficking , these be unlikely to be Rab gef and they be not pursue further in this study ."
43						Figure 1 .
44						denn protein form a large family in human cell .
45						"a schematic show the human denn domain protein , with the upstream ( u-denn ) , core DENN , and downstream ( d-denn ) region indicate ."
46						additional domain likely to be of relevance for DENN target or regulation be marked and color code .
47						"sequence alignment of denn be do with clustalx or muscle , and the result be visualize and manipulate with jalview ."
48						linear sequence motif be browse in the elm database .
49						Accession number use for this analysis be list in Table s1 .
50						dennd1 regulate rab35 dependent shiga toxin trafficking to the TGN
51						"as a first step in the systematic characterization of Rab nucleotide exchange activity , it be important to ensure that a known Rab GEF would give the expected pattern of specificity ."
52						the vps9 domain gef rabex-5 be use for this purpose .
53			"e41,e42,e43,e44"	s6	"rabex-5 promote GDP release from rab5a-c , and display some activity toward the rab5 subfamily gtpase rab17 , rab21 , and rab22a "	"as expect , rabex-5 promote GDP release from rab5a-c , and display some activity toward the rab5 subfamily gtpase rab17 , rab21 , and rab22a ."
54						other rab fall below the background value set at twice the median .
55						the short form of dennd1b encode only a denn domain be then test for gef activity use the GDP release assay .
56			e45	s6	dennd1b-s promote GDP release from rab35	this reveal that dennd1b-s promote GDP release from rab35 but not the other rab test .
57						"for true gef activity , gtp binding rapidly follow GDP release , and it be therefore important to test this ."
58						DENND1B-S specifically promote gtp binding to rab35 but not the other rab test .
59						similar result be obtain for dennd1a and the long form of dennd1b .
60						dennd1c in contrast be most active toward rab13 and show no activity to rab35 .
61			"e47,e48"	s6	dennd1a and dennd1b be rab35 specific gef 	"together , these finding show that dennd1a and dennd1b be rab35 specific gef , and that this activity be cause by the denn domain ."
62						figure 2 .
63						dennd1a and 1b be gef for rab35 .
64						( a ) human rabex-5 be test against a representative panel of human rab protein use the GDP release assay .
65						"in brief , 10 microg of each gst tag Rab to be test be incubate in 50 mm hepes-naoh , ph 6.8 , 0.1 mg and ml bsa , 125 microm edta , 10 microm mg-gdp , and 5 microcus [ 3h ] - GDP ( 10 mci and ml ; 5,000 ci and mmol ) in a total volume of 200 microl for 15 min at 30degreesC to load the rab with the radioactive gdp probe ."
66						"for standard GDP release gef assay , 100 microl of the load reaction be then mix with 10 microl of 10 mm mg-gtp and 10 nm his6 tag rabex-5 purify from bacterium or a buffer control , then adjust to 120 microl final volume with assay buffer ."
67						the gef reaction occur for 20 min at 30degreesC .
68						"after this , 2.5 microl be take for a specific activity measurement ; the remainder be split into two tube , then incubate with 500 microl of ice-cold assay buffer contain 1 mm mgcl2 and 20 microl of packed glutathione-sepharose for 60 min at 4degreesc to separate rab-gdp complex from free "" release "" GDP ."
69						"after wash three time with 500 microl of ice-cold assay buffer , the sepharose be transfer to a vial contain 4 ml of scintillation fluid and count ."
70						the amount of nucleotide exchange be calculate in pmole of GDP release .
71						( b and c ) a representative panel of human rab protein be test against 10 nm of his6 tag dennd1b-s in the GDP release ( b ) or gtp binding assay ( c ) .
72						"for gtp binding assay , the follow modification be make : only unlabeled gdp be use in the load reaction ; in the gef reaction , 0.5 microl of 10 mm gtp and 1 microcus [ 35 ] - gtpgamma ( 10 mci and ml ; 5000 Ci and mmol ) be use ."
73						the amount of nucleotide exchange be calculate in pmole of gtp bind .
74						"( d and e ) human dennd1a ( d ) , dennd1b-l ( d ) , and dennd1c ( e ) be test against a subset of rab35 related rab use the gtp binding assay ."
75						"for these assay , 10 nm of flag tag dennd1a or dennd1c purify from helum cell , or 10 nm of his6 tag dennd1b-l purify from bacterium be use ."
76						error bar show the standard error from the mean .
77						the red line mark double the median value take as a threshold .
78	taxonomy:9606	human	s7			human rab35 have previously be identify in a screen for regulator of shiga toxin trafficking from the plasma membrane to the trans-golgi network .
79			e49	s7	dennd1a and dennd1b be specific gef for rab35	"if dennd1a and dennd1b be specific gef for rab35 , then they might be expect to localize to a membrane compartment of this trafficking pathway ."
80	tissuelist:TS-0136	HeLa cells	c3			"dennd1a localization be therefore examine in helum cell , where it be find to target to small punctate structure overlap with clathrin and the plasma membrane ap-2 clathrin adaptor ."
81						the ap-1 and ap-3 clathrin adaptor associate with other trafficking step do not overlap with dennd1a .
82						analysis of dennd1a complex use mass spectrometry show that they contain clathrin and component of the ap and 2 complex but not other clathrin adaptor .
83			"e50,e51"	c3	 dennd1a specifically interact with clathrin and the ap and 2 complex	western blotting confirm that dennd1a specifically interact with clathrin and the ap and 2 complex but not other adaptor .
84						the other dennd1 family member dennd1b and dennd1c do not interact with clathrin or clathrin adaptor .
85						"depletion of clathrin cause loss of the punctate dennd1a plasma membrane staining and overlap with ap-2 , and result in a diffuse cytoplasmic and reticular pattern ."
86						"dennd1a therefore target to clathrin and the ap-2-positive patch at the plasma membrane , which support the idea that it function in some form of endocytic trafficking ."
87						"to test this idea , helum cell be deplete of dennd1a , dennd1b , and clathrin , then test for receptor mediate uptake of the growth factor egf or the transport of shiga toxin b subunit ( stxb ) to the trans-golgi network ."
88						cell deplete of dennd1a fail to transport stxb to the trans-golgi network .
89						"in the same cell , the uptake of egf into punctate endosomal structure be not alter ."
90						depletion of clathrin strongly reduce egf uptake and cause the transferrin receptor to accumulate at the cell surface rather than show its normal punctate recycle endosome distribution .
91						"although clathrin depletion do not block stxb uptake , uptake efficiency be reduce and it fail to overlap with the trans-golgi network marker tgn46 after 60 min ."
92						"together , these finding support the idea that dennd1a be a rab35 gef regulate a endocytic trafficking pathway use by the Shiga toxin to reach the trans-golgi network , but that dennd1a be not essential for the receptor mediate uptake of egf ."
93						Figure 3 .
94						localization of dennd1a be clathrin dependent .
95						"( a ) helum cell express egfp tag dennd1a ( green ) be fix and then stain with antibody to clathrin heavy chain , and the ap-1 , ap-2 , and ap-3 clathrin adaptor complex ( red ) ."
96						dna be stain with dapus ( blue ) .
97						( b ) dennd1a and dennd1b complex be analyze by mass spectrometry .
98						the protein score highest by the Sequest search algorithm be list in the table .
99						"( c ) helum cell be transfect with construct encode flag tag dennd1a , dennd1b-l , dennd1b-s , and dennd1c for 48 h ."
100						"the cell be wash from the dish use PBS with 1 mm edta , and the cell pellet be lyse for 20 min on ice in 1 ml cell of lysis buffer ( 50 mm tris-hcl , ph 7.4 , 1 mm edta , 150 mm nacl , 0.5 % Triton x-100 , and protease inhibitor cocktail ) ."
101						the flag tag protein be immunoprecipitate from the clarified lysate use 20 microl of anti-flag m2 affinity gel ( Sigma-Aldrich ) for 4 h at 4degreesc .
102						"the pellet be wash three time in 1 ml of cell lysis buffer , and bind protein be elute with 1 ml of 200 microg and ml flag peptide in tb and then precipitate for 60 min on ice use 10 % trichloroacetic acid ."
103						"the flag tag dennd1a , dennd1b-l , dennd1b-s , and dennd1c complex be analyze by sds-page on 4-12 % gradient gel and Coomassie blue staining , or western blot for clathrin heavy chain ( CHC ) and the ap-1 and ap-2 clathrin adaptor on 10 % gel ."
104						Asterisks mark protein that nonspecifically bind to flag-agarose and be find in negative control condition .
105						molecular mass standard be indicate in kilodalton .
106						"( d ) helum cell express egfp tag dennd1a ( green ) be transfect for 72 h with sirna duplex target the clathrin heavy chain , fix , and then stain with antibody for clathrin and the ap-2 clathrin adaptor ( red ) ."
107						dna be stain with dapus ( blue ) .
108						"enlargement be show to the right to more clearly demonstrate the overlap between dennd1a ( green ) , and clathrin or ap2 ( red ) in control cell , and the loss of punctate dennd1 staining after clathrin heavy chain depletion ."
109						"bar , 10 microm ."
110						Figure 4 .
111						dennd1a be require for rab35 dependent shiga toxin trafficking to the trans-golgi network .
112						"( a ) helum cell express egfp tag dennd1a and the long or short form of dennd1b be transfect with sirna duplex to dennd1a , dennd1b , clathrin heavy chain ( CHC ) , or a nonspecific control for 72 h , then western blot as indicate ."
113						molecular mass standard be indicate in kilodalton .
114						the asterisk indicate a nonspecific cross reaction of the clathrin heavy chain antibody .
115						( b ) dual egf and stxb uptake assay be perform for 60 min as describe previously in cell transfect with control or dennd1a duplex for 72 h. cell be fix and then stain for the golgus marker golgin-160 .
116						( c ) uptake assay be perform as in b use cell transfect with CHC siRNA duplex .
117						cell be fix and then stain for the transferrin receptor ( tfr ) to mark recycle endosome or the TGN marker tgn46 .
118						"bar , 10 microm ."
119						( d ) the extent of egf and shiga toxin uptake under the various condition be measure and be plot in the graph ( n = 3 ) .
120						imagej be use to measure colocalization of marker .
121						error bar indicate standard error of the mean .
122						the dennd2 family regulate rab9 and lysosome distribution
123			e52	s7	dennd1 protein be Rab gef	"have successfully show that the dennd1 protein be Rab gef , other denn protein be then investigate start with the dennd2 family ."
124						"the dennd2 family have four member , and one of these , dennd2d , comprise only a denn domain ."
125						this be test first .
126						"dennd2d display specific GDP release activity to both rab9a and rab9b but not any other rab test , which support the view that the denn domain alone be responsible for gef activity ."
127						this specificity be confirm for the three other dennd2 family member .
128						"examination of dennd2 family localization reveal that dennd2a and dennd2b be present on filament reminiscent of actin , that dennd2c overexpression cause cell shape change and form large patch in cell protrusion , and that dennd2d be diffusely located throughout the entire cell ( and s1 ) ."
129						the pronounced actin filament localization of dennd2a be especially intriguing because it be recently show that the rho family protein rhobtb3 be a rab9 effector protein .
130						"rho family protein be typically associate with process control the actin cytoskeleton , and this suggest there may be a link between rab9 function and the actin cytoskeleton ."
131						"as expect , rab9 be present on lamp1 positive lysosome define by the marker lamp1 ."
132						"depletion of rab9 or dennd2a result in a similar phenotype , where lysosome cluster adjacent to the perinuclear region and be lose from the more peripheral region of the cell ."
133						depletion of other dennd2 family member have no obvious effect in helum cell ( and not depict ) .
134						"rab9 have a well document function in trafficking of the mannose-6-phosphate receptor ( mpr ) between the TGN and late endosome , and this function be therefore investigate ."
135						cell deplete of rab9 or dennd2a show reduce intensity of mpr staining relative to control cell and a loss of mpr positive structure in the cell periphery .
136						fluorescence intensity measurement either integrate the total cell associated signal or take a transection through the perinuclear region indicate that there be a > 60 % reduction in mpr staining intensity in dennd2a-_NN and rab9 deplete cell .
137						"block rab9 function prevent recycling of mpr from late endosome back to the TGN ; thus , the MPR may become trap in late endosome and may enter the lysosome , where it will be degrade ."
138						other TGN recycling pathway be not obviously perturb by rab9 or dennd2a depletion because the TGN marker tgn46 be not change by these treatment .
139						"consistent with the biochemical gef assay datum , loss of rab9 activity either by deplete rab9 or its GEF regulator dennd2a cause a similar phenotype ."
140						these finding support the idea that the dennd2 family member act as gef for rab9 in trafficking between the late endosome and the TGN .
141						"interestingly , component of the bloc complex involve in trafficking to lysosome like organelle have be find to associate with actin filament and to interact with rab9 ."
142						"the diversity of dennd2 family member suggest that this pathway be regulate differently in different tissue , possibly link rab9 regulation at late endosome and lysosome related organelle to the status of the actin cytoskeleton ."
143						Figure 5 .
144						the dennd2 family regulate rab9 and lysosome .
145						( a ) a representative panel of human rab protein be test against 10 nm of his6 tag human dennd2d purify from bacterium use the GDP release assay .
146						"( b ) human dennd2a , dennd2b , and dennd2c be express as his6 tag protein in bacterium and then test against a subset of rab9 related rab ."
147						error bar show the standard error of the mean .
148						the red line mark double the median value .
149						"( c ) helum cell be transfect with egfp tag dennd2a or rab9a ( green ) , fix after 24 h , and stain with the antibody indicate ( red ) ."
150						dna be stain with dapus ( blue ) .
151						"inset enlargement be show to more clearly demonstrate the relationship between rab9 ( green ) and lamp1 ( red ) , which suggest that rab9 be present on the lysosome membrane ."
152						"( d ) helum cell express egfp tag rab9 or dennd2 construct as indicate be transfect with control , rab9a , rab9b , and dennd2a-d sirna duplex for 72 h. western blotting with egfp antibody confirm depletion of the target protein , whereas tubulin show that load be equal for all sample ."
153						"helum cell transfect with control , rab9a and rab9b , and dennd2a-d sirna duplex for 72 h be fix , then stain for lamp1 ( red ) and dapus to detect dna ( blue ) ."
154						molecular mass standard be indicate in kilodalton .
155						"( e ) helum cell transfect with control , rab9a and rab9b , and dennd2a sirna duplex for 72 h be fix , then stain for MPR ( green ) and tgn46 ( red ) ."
156						dna be stain with dapus ( blue ) .
157						"bar , 10 microm ."
158						( f ) fluorescence intensity for mpr staining from e be measure use imagej by draw a box around the entire cell area and integrate the total signal .
159						a equivalent area with no cell be subtract for the background .
160						"this be perform for 24 cell , and the mean and standard error be plot on the bar graph ."
161						a 20 x 1 microm line measurement be perform across the nuclear region where MPR staining be most cluster .
162						"the pixel intensity along the line be plot in the graph for control , dennd2a , and rab9a-_NN and rab9b deplete cell ."
163			e53	c4	dennd4 family protein be specific gef for rab10	dennd4 family protein be specific gef for rab10 in apical sorting
164						the role of rab8 and rab10 in apical and basolateral sorting be well establish .
165						"question remain , however , about how these two gtpase be independently regulate ."
166						"two gef carry the sec2 domain have be report to show activity toward rab8 , but the gef for rab10 be unknown ."
167			e54	c4	analysis of the dennd4 family protein show that these specifically promote GDP release from and gtp binding to rab10	analysis of the dennd4 family protein show that these specifically promote GDP release from and gtp binding to rab10 and have no activity toward rab8 .
168						"in contrast , sec2 domain protein rabin3 and rabin8 and rabin3-like and GRAB be specific gef for rab8a and rab8b and have no activity toward rab10 ."
169			"e56,e57,e58"	c4	" the sec2 domain protein rabin8 and GRAB , and the denn domain protein of the dennd4 family could provide a means to activate rab8 and rab10 "	"thus , the sec2 domain protein rabin8 and GRAB , and the denn domain protein of the dennd4 family could provide a means to activate rab8 and rab10 , respectively , and thus independently control polarize trafficking ."
170	tissuelist:TS-0136	HeLa cells	c4			"although dennd4a and dennd4c show a diffuse cytoplasmic localization in helum cell , dennd4b be present on a tubular membrane compartment emanate from the perinuclear region ( and s1 ) ."
171						"strikingly , dennd4b staining be coincident with that of its target rab10 ."
172						"this compartment do not overlap with marker for early endosome , recycle endosome , or lysosome , but do show partial overlap with the golgus marker gm130 ."
173						Figure 6 .
174						dennd4 family protein be specific gef for rab10 .
