145						Paracellular permeability was determined using 4 kD FITC conjugated Dextran and 70 kD Rhodamine B conjugated dextran over a time of 3 hours .
146						Fluorescence was then determined with a FLUOstar OPTIMA microplate reader ( BMGLabTech , Offenburg , Germany ) .
147						Immunostaining and microscopy
148						Cells were fixed in methanol or 3 % PFA as previously described and stained with the appropriate fluorescent secondary antibodies conjugated to either FITC , Cy3 , Cy5 or AMCA ( 1:600 dilutions ; Jackson ImmunoResearch Inc. ) or incubated with FITC or TRITC conjugated Phalloidin ( Sigma ) or DNA stain Hoechst 33258 ( Invitrogen ) .
149						Slides were observed under a Leica DMIRB fluorescent microscope , and Zeiss LSM 510 and 700 confocal laser scanning microscopes using 63x immersion oil lenses .
150						Images were acquired using simple PCI and LSM510 and ZEN operating softwares , respectively .
151						Image were adjusted for brightness and contrast with Adobe Photoshop .
152						For FRET experiments , siRNA transfected cells were plated into ibid multi-well chamber slides and then transfected with pRaichu-RhoA ( kindly provided by M. Matsuda , Osaka University , Japan ) .
153						The FRET analysis was performed at 37degreesC with a Leica SP2 microscope using the manufacturer 's software measuring donor recovery after acceptor bleaching ( YFP was bleached to 30 % ) .
154						FRET efficiency maps were then produced with the Leica software .
155						For quantification , CFP images were subtracted and then quantified with ImageJ .
156						For each image , all cell-cell contacts were quantified and as many internal areas ; averages of all cell-cell contacts and all internal areas then gave one value each per image , and these values were used for the final statistical analysis .
157						Normalisations were performed by dividing values obtained for specific fields by the values obtained for the entire field imaged .
158						Immunoblotting , immunoprecipitations , GST pull downs , RhoGTPase activation assays
159						Whole cell lysates were collected by washing twice with PBS before adding SDS-PAGE sample buffer and heating at 70degreesC for 10 minutes before homogenising with a 23G needle .
160						Samples were processed using standard western blotting techniques .
161						Protein bound antibodies were detected with horseradish peroxidase conjugated secondary antibodies using enhanced chemiluminescence detection system ( ECL , Amersham , Corp. .
162						Arlington Heights , IL ) , or IRDye-680- and IRDye-800CW-conjugated secondary antibodies and an Odyssey detector ( LI-COR ) .
163						For immunoprecipitations , Caco2 cells were extracted at 4degreesC with 10 mM Hepes ( pH 7.4 ) , containing 150 mM NaCl , 1 % Triton X-100 , 0.5 % sodium deoxycholate , 0.2 % SDS and a cocktail of protease and phosphotase inhibitors as previously described .
164						Extracts were pre-adsorbed with inactive sepharose beads for 15 minutes prior to incubation with antibodies conjugated to Protein G sepharose beads for 2 hours at 4degreesC .
165						Samples were washed twice with 0.5 % Triton X-100 in PBS and once with PBS before adding SDS-PAGE sample buffer .
166						For GST pull-down experiments with p114RhoGEF fusion proteins , cells were extracted with the same buffer at 4degreesC and preadsorbed with inactive beads as above for immunoprecipitations .
167						Extracts were incubated with glutathione-agarose beads coated with 15 mug of fusion proteins and incubated for 2 hours at 4degreesC before washing as described for immunoprecipitations .
168						For RhoGTPase activation assays , cells were transfected with the appropriate siRNAs in 12-well plates and , after 72 hours , protein was harvested and analysed for levels of active RhoA , Cdc42 and Rac1 using the respective G-LISA assay kits from Cytoskeleton Inc. .
169						Protein concentrations were equilibrated before incubation with the coated 96-well plates and HRP conjugated secondary antibodies were used for detection .
170						Samples of cell extracts were immunoblotted for the GTPases to exclude altered expression levels .
171						Statistical analysis
172						Averages and standard deviations were calculated and provided in the graphs .
173						Respective n values are provided in the figure legends .
174						The indicated p values were obtained with two tailed Student 's t-test .
175						Figure 1
176						p114RhoGEF is a TJ associated RhoA GEF that regulates junction formation and the actin cytoskeleton .
177						Caco-2 and HCE cells transfected with non targeting ( Control ) or siRNAs directed against p114RhoGEF ( p114RG ) .
178						Lysates were analysed by immunoblotting p114RhoGEF and alpha-tubulin .
179						Uncropped images are shown .
180						( b - e ) HCE and Caco-2 cells were processed for immunofluorescence using antibodies against the proteins indicated .
181						In c , cells were transfected with siRNAs targeting p114RhoGEF prior to immunofluorescence .
182						Panels b and c are epifluorescence images whereas d and e are confocal xy and z line scans .
183						( f ) Levels of active Rho GTPases in HCE cells were measured after transfection of either control or p114RhoGEF targeting siRNAs .
184						Shown are averages + /- 1SD , n = 3 .
185						( g , h ) Caco-2 and HCE cells were transfected with siRNAs ( for p114RhoGEF , a pool containing siRNA1 and 2 were used ) and then processed for immunofluorescence using antibodies against the indicated proteins ( g ) or fluorescent phalloidin to label f-actin ( h ) .
186						For the columnar Caco-2 cells , two epifluorescence images are shown for the actin staining , one taken focusing on the apical region and one from the base of the cells .
187						For the flat HCE cells , a single epifluorescence image is shown that includes lateral and basal actin staining .
188						See for other tight junction markers and experiments with individual siRNAs .
189						Bars , 10 mum .
190						Figure 2
191						p114RhoGEF regulates epithelial barrier formation .
192						( a-c ) Caco-2 cells transfected with control or two different pools of p114RhoGEF specific siRNAs ( OnT refers to the On-Target pool ) were trypsinised and plated onto filters in low calcium media for 24 hours to prevent forming of cell-cell contacts .
193						Expression of p114RhoGEF and other junctional proteins was assayed at the end of the experiment by immunoblotting .
194						Uncropped images are shown .
195						Normal calcium containing medium was added and cell contact formation was monitored during the next 48 hours by measuring transepithelial electrical resistance ( b , shown are averages + /- 1SD , n = 3 ) .
196						Paracellular tracer permeability was then determined using fluorescently labelled dextrans ( c , shown are averages + /- 1SD , n = 3 ) .
197						( d - h ) Cells transfected with siRNAs and plated in low calcium followed by incubations in normal calcium were processed for immunoblotting ( d , 24 hours of calcium , uncropped images are shown ) or fixed at the indicated times and processed for immunofluorescence analysis using an epifluorescence microscope ( e , ZO-1 ; f , f-actin ; g , p114RhoGEF and myosin IIA ) .
198						See for additional junctional markers analysed .
199						Focal planes for the epifluorescence images in panels f , g and h were chosen so that they include lateral and basal staining .
200						Note , p114RhoGEF depleted cells , in contrast to GEF-H1 depleted , spread normally but did not assemble morphologically normal junctions .
201						Bars , 10 mum .
202						Figure 3
203						p114RhoGEF regulates epithelial morphogenesis in three-dimensional cultures .
204						p114RhoGEF was depleted by transfecting siRNAs into Caco-2 cells ( a-c ) or by generating MDCK cells expressing shRNAs ( d-e ) .
205						The cells were then cultured in three-dimensional gels .
206						After 5 days , the cultures were analysed by phase contrast microscopy and quantified by counting cysts with a single lumen or structures with a disorganised appearance and multiple lumens ( b , e ; averages + /- 1SD ; b , n = 3 ; e , n = 5 ) .
207						The cultures were then fixed and processed for analysis by confocal microscopy using the indicated antibodies and fluorescent labels ( c , f ) .
208						Bars , 30 mum and 10 mum ( c , f ) .
209						See for immunoblot analysis of p114RhoGEF expression .
210						Figure 4
211						p114RhoGEF regulates RhoA signalling at cell junctions .
212						( a-b ) Cells were transfected with siRNAs and , after 2 days , with a RhoA FRET biosensor .
213						RhoA activity was then imaged by gain of CFP fluorescence after acceptor bleaching .
214						Shown are images of control , p114RhoGEF and GEF-H1 depleted cells taken from the apical part of the cells that contains the junctional complex ( a ; see for basal sections ) .
215						Images to monitor Rho activity during junction formation were taken between 1 and 2 hours after adding calcium ( Ca-Switch ) .
216						Images were quantified by normalising FRET signals in specific regions ( cell-cell contacts or interior cytoplasm ) with the total FRET signal in the quantified fields ( b ; averages + /- 1SD ; n : Caco-2 , 30 for control and p114RhoGEF and 12 for GEF-H1 ; HCE , 20 for control , 14 for p114RhoGEF , 12 for GEF-H1 ; Ca-Switch , 10 ) .
217						( c-d ) Caco-2 cells ( c ) and HCE cells , transfected with the specified siRNAs , were processed for immunofluorescence as indicated and analysed by epifluorescence microscopy .
218						For Caco-2 cells , images taken form the apical and the basal regions are shown whereas a single image is shown for HCE cells that includes lateral and basal staining .
219						( e ) Levels of active RhoA were measured after tetracycline induced expression of p114RhoGEF-VSV , labelled as WT , or p114RhoGEFY260A-VSV , labelled as Y260A , in MDCK cells .
220						Shown are averages + /- 1SD , n = 3 .
221						( f ) HCE ells were transfected with the indicated constructs for p114RhoGEF and GEF-H1 expression and then processed for immunofluorescence and confocal microscopy .
222						Shown are z line scans and xy sections .
223						Note , the contracted appearance of cells expressing active p114RhoGEF .
224						( g ) Images from samples as those in panel f for HCE cells and analogous samples generated with Caco-2 cells were quantified by counting transfected cells with a rounded and contracted appearance and cells that remained normal and flat .
225						Shown are averages + /- 1SD , n = 3 .
226						( h ) HCE cells transfected as in panel f were stained for ZO-1 and beta-catenin , and imaged by epifluorescence microscopy ( the used antibody against ZO-1 crossreacts with a nuclear antigen in human cells ) .
227						The overlay shows ZO-1 in green , beta-catenin in blue and VSV in red .
228						Bars , 10 mum .
229						Figure 5
230						114RhoGEF forms a complex with myosin II , cingulin and Rock II .
231						p114RhoGEF was immuoprecipitated from cell extracts of normally cultured Caco-2 cells or cells kept in low calcium to prevent junction formation .
232						Beads conjugated with a non related goat IgG were used as negative control .
233						Coprecipitating proteins were analysed by immunoblotting as indicated .
234						Uncropped images are shown .
235						( b ) GST fusion proteins containing different domains of p114RhoGEF were bound to beads and used for pull down experiments with Caco-2 cell extract .
236						Pull downs were analysed by immunoblotting .
237						( c ) Cells were transfected with control or cingulin targeting siRNAs and expression of the indicated proteins was analysed by immunoblotting .
238						( d , e ) Caco-2 and HCE cells were transfected with siRNAs as in panel c and then fixed and processed for immunofluorescence to localise p114RhoGEF and junctional proteins .
239						Shown are fields from depleted samples that still express some cingulin ( labelled with asterisks ) .
240						( f ) HCE cells were transfected with siRNAs as indicated and then processed for immunofluorescence .
241						All immunofluorescence images shown were acquired by epifluorescence microscopy and include lateral and basal structures .
242						Bars , 10 mum .
